Password:tcpdump: data link type PKTAP
tcpdump: verbose output suppressed, use -v[v]... for full protocol decode
listening on any, link-type PKTAP (Apple DLT_PKTAP), snapshot length 524288 bytes
19:38:30.953924 IP 10.0.81.207.vcom-tunnel > 10.0.81.223.49494: Flags [P.], seq 3615777059:3615777061, ack 1413308879, win 508, options [nop,nop,TS val 975083474 ecr 1753903745], length 2
E..6..@.@...
.Q.
.Q..A.V..a#T=a............
:...h.r...
19:38:30.954038 IP 10.0.81.223.49494 > 10.0.81.207.vcom-tunnel: Flags [.], ack 2, win 2048, options [nop,nop,TS val 1753904745 ecr 975083474], length 0
E..4..@.@...
.Q.
.Q..V.AT=a...a%...........
h.vi:...
19:38:30.954160 IP 10.0.81.223.49494 > 10.0.81.207.vcom-tunnel: Flags [P.], seq 1:7, ack 2, win 2048, options [nop,nop,TS val 1753904745 ecr 975083474], length 6
E..:..@.@...
.Q.
.Q..V.AT=a...a%...........
h.vi:.......M.
19:38:30.954512 IP 10.0.81.207.vcom-tunnel > 10.0.81.223.49494: Flags [.], ack 7, win 508, options [nop,nop,TS val 975083474 ecr 1753904745], length 0
E..4..@.@...
.Q.
.Q..A.V..a%T=a.....<......
:...h.vi
19:38:31.954266 IP 10.0.81.207.vcom-tunnel > 10.0.81.223.49494: Flags [P.], seq 2:4, ack 7, win 508, options [nop,nop,TS val 975084474 ecr 1753904745], length 2
E..6..@.@...
.Q.
.Q..A.V..a%T=a............
:...h.vi..
19:38:31.954333 IP 10.0.81.223.49494 > 10.0.81.207.vcom-tunnel: Flags [.], ack 4, win 2048, options [nop,nop,TS val 1753905745 ecr 975084474], length 0
E..4..@.@...
.Q.
.Q..V.AT=a...a'...........
h.zQ:...
19:38:31.954413 IP 10.0.81.223.49494 > 10.0.81.207.vcom-tunnel: Flags [P.], seq 7:13, ack 4, win 2048, options [nop,nop,TS val 1753905745 ecr 975084474], length 6
E..:..@.@...
.Q.
.Q..V.AT=a...a'...........
h.zQ:......FLG
19:38:31.954728 IP 10.0.81.207.vcom-tunnel > 10.0.81.223.49494: Flags [.], ack 13, win 508, options [nop,nop,TS val 975084474 ecr 1753905745], length 0
E..4..@.@...
.Q.
.Q..A.V..a'T=a.....5......
:...h.zQ
19:38:32.954049 IP 10.0.81.207.vcom-tunnel > 10.0.81.223.49494: Flags [P.], seq 4:6, ack 13, win 508, options [nop,nop,TS val 975085474 ecr 1753905745], length 2
E..6..@.@...
.Q.
.Q..A.V..a'T=a............
:...h.zQ..
19:38:32.954213 IP 10.0.81.223.49494 > 10.0.81.207.vcom-tunnel: Flags [.], ack 6, win 2048, options [nop,nop,TS val 1753906745 ecr 975085474], length 0
E..4..@.@...
.Q.
.Q..V.AT=a...a)...........
h.~9:...
19:38:32.954387 IP 10.0.81.223.49494 > 10.0.81.207.vcom-tunnel: Flags [P.], seq 13:19, ack 6, win 2048, options [nop,nop,TS val 1753906745 ecr 975085474], length 6
E..:..@.@...
.Q.
.Q..V.AT=a...a)...........
h.~9:.......Sl
19:38:32.954742 IP 10.0.81.207.vcom-tunnel > 10.0.81.223.49494: Flags [.], ack 19, win 508, options [nop,nop,TS val 975085474 ecr 1753906745], length 0
E..4..@.@...
.Q.
.Q..A.V..a)T=a.....-*.....
:...h.~9
19:38:33.953935 IP 10.0.81.207.vcom-tunnel > 10.0.81.223.49494: Flags [P.], seq 6:8, ack 19, win 508, options [nop,nop,TS val 975086474 ecr 1753906745], length 2
E..6..@.@...
.Q.
.Q..A.V..a)T=a......7.....
:...h.~9..
19:38:33.954074 IP 10.0.81.223.49494 > 10.0.81.207.vcom-tunnel: Flags [.], ack 8, win 2048, options [nop,nop,TS val 1753907745 ecr 975086474], length 0
E..4..@.@...
.Q.
.Q..V.AT=a...a+...........
h..!:...
19:38:33.954206 IP 10.0.81.223.49494 > 10.0.81.207.vcom-tunnel: Flags [P.], seq 19:25, ack 8, win 2048, options [nop,nop,TS val 1753907745 ecr 975086474], length 6
E..:..@.@...
.Q.
.Q..V.AT=a...a+...........
h..!:.....'w..
19:38:33.954585 IP 10.0.81.207.vcom-tunnel > 10.0.81.223.49494: Flags [.], ack 25, win 508, options [nop,nop,TS val 975086474 ecr 1753907745], length 0
E..4..@.@...
.Q.
.Q..A.V..a+T=a.....%R.....
:...h..!
19:38:34.954127 IP 10.0.81.207.vcom-tunnel > 10.0.81.223.49494: Flags [P.], seq 8:10, ack 25, win 508, options [nop,nop,TS val 975087474 ecr 1753907745], length 2
E..6..@.@..

.Q.
.Q..A.V..a+T=a......_.....
:..rh..!..
19:38:34.954300 IP 10.0.81.223.49494 > 10.0.81.207.vcom-tunnel: Flags [.], ack 10, win 2048, options [nop,nop,TS val 1753908745 ecr 975087474], length 0
E..4..@.@...
.Q.
.Q..V.AT=a...a-...........
h..	:..r
19:38:34.954463 IP 10.0.81.223.49494 > 10.0.81.207.vcom-tunnel: Flags [P.], seq 25:31, ack 10, win 2048, options [nop,nop,TS val 1753908745 ecr 975087474], length 6
E..:..@.@...
.Q.
.Q..V.AT=a...a-...........
h..	:..r.....@
19:38:34.954828 IP 10.0.81.207.vcom-tunnel > 10.0.81.223.49494: Flags [.], ack 31, win 508, options [nop,nop,TS val 975087474 ecr 1753908745], length 0
E..4..@.@..
.Q.
.Q..A.V..a-T=a......z.....
:..rh..	
19:38:35.767832 IP 10.0.81.207.vcom-tunnel > 10.0.81.223.49493: Flags [.], ack 2173854626, win 501, options [nop,nop,TS val 975088287 ecr 219540161], length 0
E..4..@.@..L
.Q.
.Q..A.U......c............
:.......
19:38:35.767945 IP 10.0.81.223.49493 > 10.0.81.207.vcom-tunnel: Flags [.], ack 1, win 2048, options [nop,nop,TS val 219555522 ecr 975042645], length 0
E..4..@.@...
.Q.
.Q..U.A..c................
..&.:..U
19:38:35.941384 IP 10.0.81.207.vcom-tunnel > 10.0.81.223.49494: Flags [P.], seq 10:1038, ack 31, win 508, options [nop,nop,TS val 975088461 ecr 1753908745], length 1028
E..8.	@.@...
.Q.
.Q..A.V..a-T=a......f.....
:..Mh..	.~..{"eventData":{"name":"MX6000 Pro_0006CC","runtime":637260,"totalRuntime":984900,"mainBoardTemperature":{"value":41,"status":0,"name":".....................","nameEn":"Mainboard Temperature"},"mainBoardVoltage":{"value":12.31,"status":0,"name":"..................","nameEn":"Mainboard Voltage"},"backupStatus":{"status":0,"errCode":108,"minNormalValue":0,"maxNormalValue":0},"fanInfos":[{"fanSpeed":2550,"fanType":16,"fanShowType":1,"fanName":"...............-1","fanNameEn":"Chassis Fan 1","status":0},{"fanSpeed":2565,"fanType":17,"fanShowType":1,"fanName":"...............-2","fanNameEn":"Chassis Fan 2","status":0},{"fanSpeed":2550,"fanType":18,"fanShowType":1,"fanName":"...............-3","fanNameEn":"Chassis Fan 3","status":0},{"fanSpeed":2535,"fanType":19,"fanShowType":2,"fanName":"...............-1","fanNameEn":"Chassis Fan 4","status":0},{"fanSpeed":2565,"fanType":20,"fanShowType":2,"fanName":"...............-2","fanNameEn":"Chassis Fan 5","status":0},{"fanSpeed":2580,"fanType":21,"fanShowType":2,"fanName":".
19:38:35.941389 IP 10.0.81.207.vcom-tunnel > 10.0.81.223.49494: Flags [P.], seq 1038:1462, ack 31, win 508, options [nop,nop,TS val 975088461 ecr 1753908745], length 424
E....
@.@..a
.Q.
.Q..A.V..e1T=a......6.....
:..Mh..	..............-3","fanNameEn":"Chassis Fan 6","status":0}],"voltageInfos":null,"temperatureInfos":null,"powerMonitorInfos":[{"powerID":0,"status":0},{"powerID":1,"status":0}],"controllerPortMonitorInfos":[{"controllerPortID":0,"status":0},{"controllerPortID":1,"status":2}],"imbLinkStatus":{"linkStatus":false,"status":0},"timestamp":"2026-03-12 02:38:35"},"eventSender":"monitor","eventType":"controllerRealTimeInfoChange"}
19:38:35.941469 IP 10.0.81.223.49494 > 10.0.81.207.vcom-tunnel: Flags [.], ack 1462, win 2026, options [nop,nop,TS val 1753909732 ecr 975088461], length 0
E..4..@.@...
.Q.
.Q..V.AT=a...f............
h...:..M
19:38:35.953811 IP 10.0.81.207.vcom-tunnel > 10.0.81.223.49494: Flags [P.], seq 1462:1464, ack 31, win 508, options [nop,nop,TS val 975088473 ecr 1753909732], length 2
E..6..@.@...
.Q.
.Q..A.V..f.T=a............
:..Yh.....
19:38:35.953906 IP 10.0.81.223.49494 > 10.0.81.207.vcom-tunnel: Flags [.], ack 1464, win 2048, options [nop,nop,TS val 1753909745 ecr 975088473], length 0
E..4..@.@...
.Q.
.Q..V.AT=a...f............
h...:..Y
19:38:35.954094 IP 10.0.81.223.49494 > 10.0.81.207.vcom-tunnel: Flags [P.], seq 31:37, ack 1464, win 2048, options [nop,nop,TS val 1753909745 ecr 975088473], length 6
E..:..@.@...
.Q.
.Q..V.AT=a...f............
h...:..Y...u6H
19:38:35.954522 IP 10.0.81.207.vcom-tunnel > 10.0.81.223.49494: Flags [.], ack 37, win 508, options [nop,nop,TS val 975088474 ecr 1753909745], length 0
E..4..@.@..	
.Q.
.Q..A.V..f.T=a............
:..Zh...
19:38:36.953814 IP 10.0.81.207.vcom-tunnel > 10.0.81.223.49494: Flags [P.], seq 1464:1466, ack 37, win 508, options [nop,nop,TS val 975089473 ecr 1753909745], length 2
E..6..@.@...
.Q.
.Q..A.V..f.T=a............
:..Ah.....
19:38:36.953928 IP 10.0.81.223.49494 > 10.0.81.207.vcom-tunnel: Flags [.], ack 1466, win 2048, options [nop,nop,TS val 1753910745 ecr 975089473], length 0
E..4..@.@...
.Q.
.Q..V.AT=a...f............
h...:..A
19:38:36.954051 IP 10.0.81.223.49494 > 10.0.81.207.vcom-tunnel: Flags [P.], seq 37:43, ack 1466, win 2048, options [nop,nop,TS val 1753910745 ecr 975089473], length 6
E..:..@.@...
.Q.
.Q..V.AT=a...f............
h...:..A......
19:38:36.954388 IP 10.0.81.207.vcom-tunnel > 10.0.81.223.49494: Flags [.], ack 43, win 508, options [nop,nop,TS val 975089474 ecr 1753910745], length 0
E..4..@.@...
.Q.
.Q..A.V..f.T=a............
:..Bh...
19:38:37.477906 IP 10.0.81.207.vcom-tunnel > 10.0.81.223.49613: Flags [.], ack 3803672362, win 508, options [nop,nop,TS val 975089997 ecr 2279948338], length 0
E..4..@.@..&
.Q.
.Q..A...n5=..o*...........
:..M..@2
19:38:37.477974 IP 10.0.81.223.49613 > 10.0.81.207.vcom-tunnel: Flags [.], ack 1, win 2053, options [nop,nop,TS val 2279963702 ecr 975042643], length 0
E..4..@.@...
.Q.
.Q....A..o*.n5>...........
..|6:..S
19:38:37.954154 IP 10.0.81.207.vcom-tunnel > 10.0.81.223.49494: Flags [P.], seq 1466:1468, ack 43, win 508, options [nop,nop,TS val 975090474 ecr 1753910745], length 2
E..6..@.@...
.Q.
.Q..A.V..f.T=a.....{+.....
:..*h.....
19:38:37.954331 IP 10.0.81.223.49494 > 10.0.81.207.vcom-tunnel: Flags [.], ack 1468, win 2048, options [nop,nop,TS val 1753911745 ecr 975090474], length 0
E..4..@.@...
.Q.
.Q..V.AT=a...f............
h...:..*
19:38:37.954501 IP 10.0.81.223.49494 > 10.0.81.207.vcom-tunnel: Flags [P.], seq 43:49, ack 1468, win 2048, options [nop,nop,TS val 1753911745 ecr 975090474], length 6
E..:..@.@...
.Q.
.Q..V.AT=a...f............
h...:..*...H.\
19:38:37.954938 IP 10.0.81.207.vcom-tunnel > 10.0.81.223.49494: Flags [.], ack 49, win 508, options [nop,nop,TS val 975090475 ecr 1753911745], length 0
E..4..@.@...
.Q.
.Q..A.V..f.T=a......E.....
:..+h...
19:38:38.954251 IP 10.0.81.207.vcom-tunnel > 10.0.81.223.49494: Flags [P.], seq 1468:1470, ack 49, win 508, options [nop,nop,TS val 975091474 ecr 1753911745], length 2
E..6..@.@...
.Q.
.Q..A.V..f.T=a.....sS.....
:...h.....
19:38:38.954417 IP 10.0.81.223.49494 > 10.0.81.207.vcom-tunnel: Flags [.], ack 1470, win 2048, options [nop,nop,TS val 1753912745 ecr 975091474], length 0
E..4..@.@...
.Q.
.Q..V.AT=a...f............
h...:...
19:38:38.954640 IP 10.0.81.223.49494 > 10.0.81.207.vcom-tunnel: Flags [P.], seq 49:55, ack 1470, win 2048, options [nop,nop,TS val 1753912745 ecr 975091474], length 6
E..:..@.@...
.Q.
.Q..V.AT=a...f............
h...:.....*Fk.
19:38:38.955050 IP 10.0.81.207.vcom-tunnel > 10.0.81.223.49494: Flags [.], ack 55, win 508, options [nop,nop,TS val 975091475 ecr 1753912745], length 0
E..4..@.@...
.Q.
.Q..A.V..f.T=b......l.....
:...h...
19:38:39.753568 IP 10.0.81.207.vcom-tunnel > 10.0.81.223.49494: Flags [P.], seq 1470:2490, ack 55, win 508, options [nop,nop,TS val 975092273 ecr 1753912745], length 1020
E..0..@.@...
.Q.
.Q..A.V..f.T=b............
:..1h....~..{"eventData":{"cabinetID":7540236129599495,"rvCardID":7540236129599495,"netPortIndex":2055,"cabinetIndex":7,"runtime":0,"totalRuntime":0,"temperature":{"value":40,"status":0,"name":"","nameEn":""},"voltage":{"value":4,"status":0,"name":"","nameEn":""},"humidity":{"value":0,"status":0,"name":"","nameEn":""},"errorBit":[{"value":0,"type":0,"status":0},{"value":0,"type":1,"status":0}],"signalInterruptCount":0,"backupStatus":{"mode":0,"status":0},"nextCabinetLinkStatus":{"linkStatus":true,"status":0},"phyTemperature":{"phy1":{"value":0,"status":0,"name":"","nameEn":""},"phy2":{"value":0,"status":0,"name":"","nameEn":""}},"moduleInfos":null,"cabinetMonitorInfo":{"cabinetID":0,"power":null,"temperature":{"value":0,"status":0,"name":"","nameEn":""},"humidity":{"value":0,"status":0,"name":"","nameEn":""},"smoke":{"value":0,"status":0,"name":"","nameEn":""},"voltage":{"value":4,"status":0,"name":"","nameEn":""}},"timestamp":"2026-03-12 02:38:38"},"eventSender":"monitor","eventType":"cabinetRealTimeInfoChange"}
19:38:39.753738 IP 10.0.81.223.49494 > 10.0.81.207.vcom-tunnel: Flags [.], ack 2490, win 2048, options [nop,nop,TS val 1753913544 ecr 975092273], length 0
E..4..@.@...
.Q.
.Q..V.AT=b...j............
h...:..1
19:38:39.753740 IP 10.0.81.207.vcom-tunnel > 10.0.81.223.49494: Flags [P.], seq 2490:3514, ack 55, win 508, options [nop,nop,TS val 975092273 ecr 1753912745], length 1024
E..4..@.@...
.Q.
.Q..A.V..j.T=b.....hy.....
:..1h....~..{"eventData":{"cabinetID":7540236129337347,"rvCardID":7540236129337347,"netPortIndex":2051,"cabinetIndex":3,"runtime":0,"totalRuntime":0,"temperature":{"value":45,"status":0,"name":"","nameEn":""},"voltage":{"value":4.1,"status":0,"name":"","nameEn":""},"humidity":{"value":0,"status":0,"name":"","nameEn":""},"errorBit":[{"value":0,"type":0,"status":0},{"value":0,"type":1,"status":0}],"signalInterruptCount":0,"backupStatus":{"mode":0,"status":0},"nextCabinetLinkStatus":{"linkStatus":true,"status":0},"phyTemperature":{"phy1":{"value":0,"status":0,"name":"","nameEn":""},"phy2":{"value":0,"status":0,"name":"","nameEn":""}},"moduleInfos":null,"cabinetMonitorInfo":{"cabinetID":0,"power":null,"temperature":{"value":0,"status":0,"name":"","nameEn":""},"humidity":{"value":0,"status":0,"name":"","nameEn":""},"smoke":{"value":0,"status":0,"name":"","nameEn":""},"voltage":{"value":4.1,"status":0,"name":"","nameEn":""}},"timestamp":"2026-03-12 02:38:38"},"eventSender":"monitor","eventType":"cabinetRealTimeInfoChange"}
19:38:39.753868 IP 10.0.81.223.49494 > 10.0.81.207.vcom-tunnel: Flags [.], ack 3514, win 2048, options [nop,nop,TS val 1753913545 ecr 975092273], length 0
E..4..@.@...
.Q.
.Q..V.AT=b...n............
h...:..1
19:38:39.753882 IP 10.0.81.207.vcom-tunnel > 10.0.81.223.49494: Flags [P.], seq 3514:4534, ack 55, win 508, options [nop,nop,TS val 975092274 ecr 1753912745], length 1020
E..0..@.@...
.Q.
.Q..A.V..n.T=b............
:..2h....~..{"eventData":{"cabinetID":7540236130582530,"rvCardID":7540236130582530,"netPortIndex":2070,"cabinetIndex":2,"runtime":0,"totalRuntime":0,"temperature":{"value":46,"status":0,"name":"","nameEn":""},"voltage":{"value":4,"status":0,"name":"","nameEn":""},"humidity":{"value":0,"status":0,"name":"","nameEn":""},"errorBit":[{"value":0,"type":0,"status":0},{"value":0,"type":1,"status":0}],"signalInterruptCount":0,"backupStatus":{"mode":0,"status":0},"nextCabinetLinkStatus":{"linkStatus":true,"status":0},"phyTemperature":{"phy1":{"value":0,"status":0,"name":"","nameEn":""},"phy2":{"value":0,"status":0,"name":"","nameEn":""}},"moduleInfos":null,"cabinetMonitorInfo":{"cabinetID":0,"power":null,"temperature":{"value":0,"status":0,"name":"","nameEn":""},"humidity":{"value":0,"status":0,"name":"","nameEn":""},"smoke":{"value":0,"status":0,"name":"","nameEn":""},"voltage":{"value":4,"status":0,"name":"","nameEn":""}},"timestamp":"2026-03-12 02:38:38"},"eventSender":"monitor","eventType":"cabinetRealTimeInfoChange"}
19:38:39.753950 IP 10.0.81.223.49494 > 10.0.81.207.vcom-tunnel: Flags [.], ack 4534, win 2048, options [nop,nop,TS val 1753913545 ecr 975092274], length 0
E..4..@.@...
.Q.
.Q..V.AT=b...r............
h...:..2
19:38:39.754347 IP 10.0.81.207.vcom-tunnel > 10.0.81.223.49494: Flags [P.], seq 4534:5554, ack 55, win 508, options [nop,nop,TS val 975092274 ecr 1753913545], length 1020
E..0..@.@...
.Q.
.Q..A.V..r.T=b............
:..2h....~..{"eventData":{"cabinetID":7540236129271808,"rvCardID":7540236129271808,"netPortIndex":2050,"cabinetIndex":0,"runtime":0,"totalRuntime":0,"temperature":{"value":46,"status":0,"name":"","nameEn":""},"voltage":{"value":4,"status":0,"name":"","nameEn":""},"humidity":{"value":0,"status":0,"name":"","nameEn":""},"errorBit":[{"value":0,"type":0,"status":0},{"value":0,"type":1,"status":0}],"signalInterruptCount":0,"backupStatus":{"mode":0,"status":0},"nextCabinetLinkStatus":{"linkStatus":true,"status":0},"phyTemperature":{"phy1":{"value":0,"status":0,"name":"","nameEn":""},"phy2":{"value":0,"status":0,"name":"","nameEn":""}},"moduleInfos":null,"cabinetMonitorInfo":{"cabinetID":0,"power":null,"temperature":{"value":0,"status":0,"name":"","nameEn":""},"humidity":{"value":0,"status":0,"name":"","nameEn":""},"smoke":{"value":0,"status":0,"name":"","nameEn":""},"voltage":{"value":4,"status":0,"name":"","nameEn":""}},"timestamp":"2026-03-12 02:38:38"},"eventSender":"monitor","eventType":"cabinetRealTimeInfoChange"}
19:38:39.754398 IP 10.0.81.223.49494 > 10.0.81.207.vcom-tunnel: Flags [.], ack 5554, win 2048, options [nop,nop,TS val 1753913545 ecr 975092274], length 0
E..4..@.@...
.Q.
.Q..V.AT=b...v............
h...:..2
19:38:39.754521 IP 10.0.81.207.vcom-tunnel > 10.0.81.223.49494: Flags [P.], seq 5554:6578, ack 55, win 508, options [nop,nop,TS val 975092274 ecr 1753913545], length 1024
E..4..@.@...
.Q.
.Q..A.V..v.T=b.....X`.....
:..2h....~..{"eventData":{"cabinetID":7540236129402884,"rvCardID":7540236129402884,"netPortIndex":2052,"cabinetIndex":4,"runtime":0,"totalRuntime":0,"temperature":{"value":46,"status":0,"name":"","nameEn":""},"voltage":{"value":4.1,"status":0,"name":"","nameEn":""},"humidity":{"value":0,"status":0,"name":"","nameEn":""},"errorBit":[{"value":0,"type":0,"status":0},{"value":0,"type":1,"status":0}],"signalInterruptCount":0,"backupStatus":{"mode":0,"status":0},"nextCabinetLinkStatus":{"linkStatus":true,"status":0},"phyTemperature":{"phy1":{"value":0,"status":0,"name":"","nameEn":""},"phy2":{"value":0,"status":0,"name":"","nameEn":""}},"moduleInfos":null,"cabinetMonitorInfo":{"cabinetID":0,"power":null,"temperature":{"value":0,"status":0,"name":"","nameEn":""},"humidity":{"value":0,"status":0,"name":"","nameEn":""},"smoke":{"value":0,"status":0,"name":"","nameEn":""},"voltage":{"value":4.1,"status":0,"name":"","nameEn":""}},"timestamp":"2026-03-12 02:38:38"},"eventSender":"monitor","eventType":"cabinetRealTimeInfoChange"}
19:38:39.754562 IP 10.0.81.223.49494 > 10.0.81.207.vcom-tunnel: Flags [.], ack 6578, win 2048, options [nop,nop,TS val 1753913545 ecr 975092274], length 0
E..4..@.@...
.Q.
.Q..V.AT=b...z............
h...:..2
19:38:39.754816 IP 10.0.81.207.vcom-tunnel > 10.0.81.223.49494: Flags [P.], seq 6578:7602, ack 55, win 508, options [nop,nop,TS val 975092274 ecr 1753913545], length 1024
E..4..@.@...
.Q.
.Q..A.V..z.T=b.....Tr.....
:..2h....~..{"eventData":{"cabinetID":7540236130058245,"rvCardID":7540236130058245,"netPortIndex":2062,"cabinetIndex":5,"runtime":0,"totalRuntime":0,"temperature":{"value":46,"status":0,"name":"","nameEn":""},"voltage":{"value":4.1,"status":0,"name":"","nameEn":""},"humidity":{"value":0,"status":0,"name":"","nameEn":""},"errorBit":[{"value":0,"type":0,"status":0},{"value":0,"type":1,"status":0}],"signalInterruptCount":0,"backupStatus":{"mode":0,"status":0},"nextCabinetLinkStatus":{"linkStatus":true,"status":0},"phyTemperature":{"phy1":{"value":0,"status":0,"name":"","nameEn":""},"phy2":{"value":0,"status":0,"name":"","nameEn":""}},"moduleInfos":null,"cabinetMonitorInfo":{"cabinetID":0,"power":null,"temperature":{"value":0,"status":0,"name":"","nameEn":""},"humidity":{"value":0,"status":0,"name":"","nameEn":""},"smoke":{"value":0,"status":0,"name":"","nameEn":""},"voltage":{"value":4.1,"status":0,"name":"","nameEn":""}},"timestamp":"2026-03-12 02:38:38"},"eventSender":"monitor","eventType":"cabinetRealTimeInfoChange"}
19:38:39.754851 IP 10.0.81.223.49494 > 10.0.81.207.vcom-tunnel: Flags [.], ack 7602, win 2048, options [nop,nop,TS val 1753913546 ecr 975092274], length 0
E..4..@.@...
.Q.
.Q..V.AT=b...~............
h...:..2
19:38:39.755084 IP 10.0.81.207.vcom-tunnel > 10.0.81.223.49494: Flags [P.], seq 7602:8622, ack 55, win 508, options [nop,nop,TS val 975092275 ecr 1753913545], length 1020
E..0..@.@...
.Q.
.Q..A.V..~.T=b............
:..3h....~..{"eventData":{"cabinetID":7540236130516992,"rvCardID":7540236130516992,"netPortIndex":2069,"cabinetIndex":0,"runtime":0,"totalRuntime":0,"temperature":{"value":44,"status":0,"name":"","nameEn":""},"voltage":{"value":4,"status":0,"name":"","nameEn":""},"humidity":{"value":0,"status":0,"name":"","nameEn":""},"errorBit":[{"value":0,"type":0,"status":0},{"value":0,"type":1,"status":0}],"signalInterruptCount":0,"backupStatus":{"mode":0,"status":0},"nextCabinetLinkStatus":{"linkStatus":true,"status":0},"phyTemperature":{"phy1":{"value":0,"status":0,"name":"","nameEn":""},"phy2":{"value":0,"status":0,"name":"","nameEn":""}},"moduleInfos":null,"cabinetMonitorInfo":{"cabinetID":0,"power":null,"temperature":{"value":0,"status":0,"name":"","nameEn":""},"humidity":{"value":0,"status":0,"name":"","nameEn":""},"smoke":{"value":0,"status":0,"name":"","nameEn":""},"voltage":{"value":4,"status":0,"name":"","nameEn":""}},"timestamp":"2026-03-12 02:38:38"},"eventSender":"monitor","eventType":"cabinetRealTimeInfoChange"}
19:38:39.755114 IP 10.0.81.223.49494 > 10.0.81.207.vcom-tunnel: Flags [.], ack 8622, win 2048, options [nop,nop,TS val 1753913546 ecr 975092275], length 0
E..4..@.@...
.Q.
.Q..V.AT=b................
h...:..3
19:38:39.755475 IP 10.0.81.207.vcom-tunnel > 10.0.81.223.49494: Flags [P.], seq 8622:9642, ack 55, win 508, options [nop,nop,TS val 975092275 ecr 1753913546], length 1020
E..0..@.@...
.Q.
.Q..A.V....T=b............
:..3h....~..{"eventData":{"cabinetID":7540236129468420,"rvCardID":7540236129468420,"netPortIndex":2053,"cabinetIndex":4,"runtime":0,"totalRuntime":0,"temperature":{"value":45,"status":0,"name":"","nameEn":""},"voltage":{"value":4,"status":0,"name":"","nameEn":""},"humidity":{"value":0,"status":0,"name":"","nameEn":""},"errorBit":[{"value":0,"type":0,"status":0},{"value":0,"type":1,"status":0}],"signalInterruptCount":0,"backupStatus":{"mode":0,"status":0},"nextCabinetLinkStatus":{"linkStatus":true,"status":0},"phyTemperature":{"phy1":{"value":0,"status":0,"name":"","nameEn":""},"phy2":{"value":0,"status":0,"name":"","nameEn":""}},"moduleInfos":null,"cabinetMonitorInfo":{"cabinetID":0,"power":null,"temperature":{"value":0,"status":0,"name":"","nameEn":""},"humidity":{"value":0,"status":0,"name":"","nameEn":""},"smoke":{"value":0,"status":0,"name":"","nameEn":""},"voltage":{"value":4,"status":0,"name":"","nameEn":""}},"timestamp":"2026-03-12 02:38:38"},"eventSender":"monitor","eventType":"cabinetRealTimeInfoChange"}
19:38:39.755581 IP 10.0.81.223.49494 > 10.0.81.207.vcom-tunnel: Flags [.], ack 9642, win 2048, options [nop,nop,TS val 1753913546 ecr 975092275], length 0
E..4..@.@...
.Q.
.Q..V.AT=b................
h...:..3
19:38:39.755609 IP 10.0.81.207.vcom-tunnel > 10.0.81.223.49494: Flags [P.], seq 9642:10662, ack 55, win 508, options [nop,nop,TS val 975092275 ecr 1753913546], length 1020
E..0..@.@...
.Q.
.Q..A.V....T=b............
:..3h....~..{"eventData":{"cabinetID":7540236130058249,"rvCardID":7540236130058249,"netPortIndex":2062,"cabinetIndex":9,"runtime":0,"totalRuntime":0,"temperature":{"value":44,"status":0,"name":"","nameEn":""},"voltage":{"value":4,"status":0,"name":"","nameEn":""},"humidity":{"value":0,"status":0,"name":"","nameEn":""},"errorBit":[{"value":0,"type":0,"status":0},{"value":0,"type":1,"status":0}],"signalInterruptCount":0,"backupStatus":{"mode":0,"status":0},"nextCabinetLinkStatus":{"linkStatus":true,"status":0},"phyTemperature":{"phy1":{"value":0,"status":0,"name":"","nameEn":""},"phy2":{"value":0,"status":0,"name":"","nameEn":""}},"moduleInfos":null,"cabinetMonitorInfo":{"cabinetID":0,"power":null,"temperature":{"value":0,"status":0,"name":"","nameEn":""},"humidity":{"value":0,"status":0,"name":"","nameEn":""},"smoke":{"value":0,"status":0,"name":"","nameEn":""},"voltage":{"value":4,"status":0,"name":"","nameEn":""}},"timestamp":"2026-03-12 02:38:38"},"eventSender":"monitor","eventType":"cabinetRealTimeInfoChange"}
19:38:39.755629 IP 10.0.81.223.49494 > 10.0.81.207.vcom-tunnel: Flags [.], ack 10662, win 2048, options [nop,nop,TS val 1753913546 ecr 975092275], length 0
E..4..@.@...
.Q.
.Q..V.AT=b................
h...:..3
19:38:39.755920 IP 10.0.81.207.vcom-tunnel > 10.0.81.223.49494: Flags [P.], seq 10662:11682, ack 55, win 508, options [nop,nop,TS val 975092276 ecr 1753913546], length 1020
E..0..@.@...
.Q.
.Q..A.V....T=b............
:..4h....~..{"eventData":{"cabinetID":7540236129665025,"rvCardID":7540236129665025,"netPortIndex":2056,"cabinetIndex":1,"runtime":0,"totalRuntime":0,"temperature":{"value":47,"status":0,"name":"","nameEn":""},"voltage":{"value":4,"status":0,"name":"","nameEn":""},"humidity":{"value":0,"status":0,"name":"","nameEn":""},"errorBit":[{"value":0,"type":0,"status":0},{"value":0,"type":1,"status":0}],"signalInterruptCount":0,"backupStatus":{"mode":0,"status":0},"nextCabinetLinkStatus":{"linkStatus":true,"status":0},"phyTemperature":{"phy1":{"value":0,"status":0,"name":"","nameEn":""},"phy2":{"value":0,"status":0,"name":"","nameEn":""}},"moduleInfos":null,"cabinetMonitorInfo":{"cabinetID":0,"power":null,"temperature":{"value":0,"status":0,"name":"","nameEn":""},"humidity":{"value":0,"status":0,"name":"","nameEn":""},"smoke":{"value":0,"status":0,"name":"","nameEn":""},"voltage":{"value":4,"status":0,"name":"","nameEn":""}},"timestamp":"2026-03-12 02:38:38"},"eventSender":"monitor","eventType":"cabinetRealTimeInfoChange"}
19:38:39.755951 IP 10.0.81.223.49494 > 10.0.81.207.vcom-tunnel: Flags [.], ack 11682, win 2048, options [nop,nop,TS val 1753913547 ecr 975092276], length 0
E..4..@.@...
.Q.
.Q..V.AT=b................
h...:..4
19:38:39.756154 IP 10.0.81.207.vcom-tunnel > 10.0.81.223.49494: Flags [P.], seq 11682:12706, ack 55, win 508, options [nop,nop,TS val 975092276 ecr 1753913546], length 1024
E..4..@.@...
.Q.
.Q..A.V....T=b.....@e.....
:..4h....~..{"eventData":{"cabinetID":7540236129730566,"rvCardID":7540236129730566,"netPortIndex":2057,"cabinetIndex":6,"runtime":0,"totalRuntime":0,"temperature":{"value":45,"status":0,"name":"","nameEn":""},"voltage":{"value":4.1,"status":0,"name":"","nameEn":""},"humidity":{"value":0,"status":0,"name":"","nameEn":""},"errorBit":[{"value":0,"type":0,"status":0},{"value":0,"type":1,"status":0}],"signalInterruptCount":0,"backupStatus":{"mode":0,"status":0},"nextCabinetLinkStatus":{"linkStatus":true,"status":0},"phyTemperature":{"phy1":{"value":0,"status":0,"name":"","nameEn":""},"phy2":{"value":0,"status":0,"name":"","nameEn":""}},"moduleInfos":null,"cabinetMonitorInfo":{"cabinetID":0,"power":null,"temperature":{"value":0,"status":0,"name":"","nameEn":""},"humidity":{"value":0,"status":0,"name":"","nameEn":""},"smoke":{"value":0,"status":0,"name":"","nameEn":""},"voltage":{"value":4.1,"status":0,"name":"","nameEn":""}},"timestamp":"2026-03-12 02:38:38"},"eventSender":"monitor","eventType":"cabinetRealTimeInfoChange"}
19:38:39.756212 IP 10.0.81.223.49494 > 10.0.81.207.vcom-tunnel: Flags [.], ack 12706, win 2048, options [nop,nop,TS val 1753913547 ecr 975092276], length 0
E..4..@.@...
.Q.
.Q..V.AT=b................
h...:..4
19:38:39.756495 IP 10.0.81.207.vcom-tunnel > 10.0.81.223.49494: Flags [P.], seq 12706:13726, ack 55, win 508, options [nop,nop,TS val 975092276 ecr 1753913547], length 1020
E..0..@.@...
.Q.
.Q..A.V....T=b............
:..4h....~..{"eventData":{"cabinetID":7540236129861632,"rvCardID":7540236129861632,"netPortIndex":2059,"cabinetIndex":0,"runtime":0,"totalRuntime":0,"temperature":{"value":46,"status":0,"name":"","nameEn":""},"voltage":{"value":4,"status":0,"name":"","nameEn":""},"humidity":{"value":0,"status":0,"name":"","nameEn":""},"errorBit":[{"value":0,"type":0,"status":0},{"value":0,"type":1,"status":0}],"signalInterruptCount":0,"backupStatus":{"mode":0,"status":0},"nextCabinetLinkStatus":{"linkStatus":true,"status":0},"phyTemperature":{"phy1":{"value":0,"status":0,"name":"","nameEn":""},"phy2":{"value":0,"status":0,"name":"","nameEn":""}},"moduleInfos":null,"cabinetMonitorInfo":{"cabinetID":0,"power":null,"temperature":{"value":0,"status":0,"name":"","nameEn":""},"humidity":{"value":0,"status":0,"name":"","nameEn":""},"smoke":{"value":0,"status":0,"name":"","nameEn":""},"voltage":{"value":4,"status":0,"name":"","nameEn":""}},"timestamp":"2026-03-12 02:38:38"},"eventSender":"monitor","eventType":"cabinetRealTimeInfoChange"}
19:38:39.756569 IP 10.0.81.223.49494 > 10.0.81.207.vcom-tunnel: Flags [.], ack 13726, win 2048, options [nop,nop,TS val 1753913547 ecr 975092276], length 0
E..4..@.@...
.Q.
.Q..V.AT=b................
h...:..4
19:38:39.756672 IP 10.0.81.207.vcom-tunnel > 10.0.81.223.49494: Flags [P.], seq 13726:14746, ack 55, win 508, options [nop,nop,TS val 975092276 ecr 1753913547], length 1020
E..0..@.@...
.Q.
.Q..A.V....T=b............
:..4h....~..{"eventData":{"cabinetID":7540236130320387,"rvCardID":7540236130320387,"netPortIndex":2066,"cabinetIndex":3,"runtime":0,"totalRuntime":0,"temperature":{"value":46,"status":0,"name":"","nameEn":""},"voltage":{"value":4,"status":0,"name":"","nameEn":""},"humidity":{"value":0,"status":0,"name":"","nameEn":""},"errorBit":[{"value":0,"type":0,"status":0},{"value":0,"type":1,"status":0}],"signalInterruptCount":0,"backupStatus":{"mode":0,"status":0},"nextCabinetLinkStatus":{"linkStatus":true,"status":0},"phyTemperature":{"phy1":{"value":0,"status":0,"name":"","nameEn":""},"phy2":{"value":0,"status":0,"name":"","nameEn":""}},"moduleInfos":null,"cabinetMonitorInfo":{"cabinetID":0,"power":null,"temperature":{"value":0,"status":0,"name":"","nameEn":""},"humidity":{"value":0,"status":0,"name":"","nameEn":""},"smoke":{"value":0,"status":0,"name":"","nameEn":""},"voltage":{"value":4,"status":0,"name":"","nameEn":""}},"timestamp":"2026-03-12 02:38:38"},"eventSender":"monitor","eventType":"cabinetRealTimeInfoChange"}
19:38:39.756718 IP 10.0.81.223.49494 > 10.0.81.207.vcom-tunnel: Flags [.], ack 14746, win 2048, options [nop,nop,TS val 1753913547 ecr 975092276], length 0
E..4..@.@...
.Q.
.Q..V.AT=b................
h...:..4
19:38:39.756957 IP 10.0.81.207.vcom-tunnel > 10.0.81.223.49494: Flags [P.], seq 14746:15770, ack 55, win 508, options [nop,nop,TS val 975092277 ecr 1753913547], length 1024
E..4. @.@...
.Q.
.Q..A.V....T=b.....4......
:..5h....~..{"eventData":{"cabinetID":7540236130123781,"rvCardID":7540236130123781,"netPortIndex":2063,"cabinetIndex":5,"runtime":0,"totalRuntime":0,"temperature":{"value":45,"status":0,"name":"","nameEn":""},"voltage":{"value":4.1,"status":0,"name":"","nameEn":""},"humidity":{"value":0,"status":0,"name":"","nameEn":""},"errorBit":[{"value":0,"type":0,"status":0},{"value":0,"type":1,"status":0}],"signalInterruptCount":0,"backupStatus":{"mode":0,"status":0},"nextCabinetLinkStatus":{"linkStatus":true,"status":0},"phyTemperature":{"phy1":{"value":0,"status":0,"name":"","nameEn":""},"phy2":{"value":0,"status":0,"name":"","nameEn":""}},"moduleInfos":null,"cabinetMonitorInfo":{"cabinetID":0,"power":null,"temperature":{"value":0,"status":0,"name":"","nameEn":""},"humidity":{"value":0,"status":0,"name":"","nameEn":""},"smoke":{"value":0,"status":0,"name":"","nameEn":""},"voltage":{"value":4.1,"status":0,"name":"","nameEn":""}},"timestamp":"2026-03-12 02:38:38"},"eventSender":"monitor","eventType":"cabinetRealTimeInfoChange"}
19:38:39.757030 IP 10.0.81.223.49494 > 10.0.81.207.vcom-tunnel: Flags [.], ack 15770, win 2048, options [nop,nop,TS val 1753913548 ecr 975092277], length 0
E..4..@.@...
.Q.
.Q..V.AT=b................
h...:..5
19:38:39.757212 IP 10.0.81.207.vcom-tunnel > 10.0.81.223.49494: Flags [P.], seq 15770:16794, ack 55, win 508, options [nop,nop,TS val 975092277 ecr 1753913547], length 1024
E..4.!@.@...
.Q.
.Q..A.V....T=b...../......
:..5h....~..{"eventData":{"cabinetID":7540236130320390,"rvCardID":7540236130320390,"netPortIndex":2066,"cabinetIndex":6,"runtime":0,"totalRuntime":0,"temperature":{"value":46,"status":0,"name":"","nameEn":""},"voltage":{"value":4.1,"status":0,"name":"","nameEn":""},"humidity":{"value":0,"status":0,"name":"","nameEn":""},"errorBit":[{"value":0,"type":0,"status":0},{"value":0,"type":1,"status":0}],"signalInterruptCount":0,"backupStatus":{"mode":0,"status":0},"nextCabinetLinkStatus":{"linkStatus":true,"status":0},"phyTemperature":{"phy1":{"value":0,"status":0,"name":"","nameEn":""},"phy2":{"value":0,"status":0,"name":"","nameEn":""}},"moduleInfos":null,"cabinetMonitorInfo":{"cabinetID":0,"power":null,"temperature":{"value":0,"status":0,"name":"","nameEn":""},"humidity":{"value":0,"status":0,"name":"","nameEn":""},"smoke":{"value":0,"status":0,"name":"","nameEn":""},"voltage":{"value":4.1,"status":0,"name":"","nameEn":""}},"timestamp":"2026-03-12 02:38:38"},"eventSender":"monitor","eventType":"cabinetRealTimeInfoChange"}
19:38:39.757247 IP 10.0.81.223.49494 > 10.0.81.207.vcom-tunnel: Flags [.], ack 16794, win 2048, options [nop,nop,TS val 1753913548 ecr 975092277], length 0
E..4..@.@...
.Q.
.Q..V.AT=b................
h...:..5
19:38:39.757458 IP 10.0.81.207.vcom-tunnel > 10.0.81.223.49494: Flags [P.], seq 16794:17814, ack 55, win 508, options [nop,nop,TS val 975092277 ecr 1753913548], length 1020
E..0."@.@...
.Q.
.Q..A.V....T=b............
:..5h....~..{"eventData":{"cabinetID":7540236130385921,"rvCardID":7540236130385921,"netPortIndex":2067,"cabinetIndex":1,"runtime":0,"totalRuntime":0,"temperature":{"value":45,"status":0,"name":"","nameEn":""},"voltage":{"value":4,"status":0,"name":"","nameEn":""},"humidity":{"value":0,"status":0,"name":"","nameEn":""},"errorBit":[{"value":0,"type":0,"status":0},{"value":0,"type":1,"status":0}],"signalInterruptCount":0,"backupStatus":{"mode":0,"status":0},"nextCabinetLinkStatus":{"linkStatus":true,"status":0},"phyTemperature":{"phy1":{"value":0,"status":0,"name":"","nameEn":""},"phy2":{"value":0,"status":0,"name":"","nameEn":""}},"moduleInfos":null,"cabinetMonitorInfo":{"cabinetID":0,"power":null,"temperature":{"value":0,"status":0,"name":"","nameEn":""},"humidity":{"value":0,"status":0,"name":"","nameEn":""},"smoke":{"value":0,"status":0,"name":"","nameEn":""},"voltage":{"value":4,"status":0,"name":"","nameEn":""}},"timestamp":"2026-03-12 02:38:38"},"eventSender":"monitor","eventType":"cabinetRealTimeInfoChange"}
19:38:39.757491 IP 10.0.81.223.49494 > 10.0.81.207.vcom-tunnel: Flags [.], ack 17814, win 2048, options [nop,nop,TS val 1753913548 ecr 975092277], length 0
E..4..@.@...
.Q.
.Q..V.AT=b................
h...:..5
19:38:39.954353 IP 10.0.81.207.vcom-tunnel > 10.0.81.223.49494: Flags [P.], seq 17814:17816, ack 55, win 508, options [nop,nop,TS val 975092474 ecr 1753913548], length 2
E..6.#@.@...
.Q.
.Q..A.V....T=b.....(......
:...h.....
19:38:39.954498 IP 10.0.81.223.49494 > 10.0.81.207.vcom-tunnel: Flags [.], ack 17816, win 2048, options [nop,nop,TS val 1753913745 ecr 975092474], length 0
E..4..@.@...
.Q.
.Q..V.AT=b................
h...:...
19:38:39.954738 IP 10.0.81.223.49494 > 10.0.81.207.vcom-tunnel: Flags [P.], seq 55:61, ack 17816, win 2048, options [nop,nop,TS val 1753913745 ecr 975092474], length 6
E..:..@.@...
.Q.
.Q..V.AT=b................
h...:........L
19:38:39.955197 IP 10.0.81.207.vcom-tunnel > 10.0.81.223.49494: Flags [.], ack 61, win 508, options [nop,nop,TS val 975092475 ecr 1753913745], length 0
E..4.$@.@...
.Q.
.Q..A.V....T=b............
:...h...
19:38:40.954186 IP 10.0.81.207.vcom-tunnel > 10.0.81.223.49494: Flags [P.], seq 17816:17818, ack 61, win 508, options [nop,nop,TS val 975093474 ecr 1753913745], length 2
E..6.%@.@...
.Q.
.Q..A.V....T=b.....#......
:...h.....
19:38:40.954306 IP 10.0.81.223.49494 > 10.0.81.207.vcom-tunnel: Flags [.], ack 17818, win 2048, options [nop,nop,TS val 1753914745 ecr 975093474], length 0
E..4..@.@...
.Q.
.Q..V.AT=b................
h..y:...
19:38:40.954478 IP 10.0.81.223.49494 > 10.0.81.207.vcom-tunnel: Flags [P.], seq 61:67, ack 17818, win 2048, options [nop,nop,TS val 1753914745 ecr 975093474], length 6
E..:..@.@...
.Q.
.Q..V.AT=b................
h..y:.........
19:38:40.954827 IP 10.0.81.207.vcom-tunnel > 10.0.81.223.49494: Flags [.], ack 67, win 508, options [nop,nop,TS val 975093474 ecr 1753914745], length 0
E..4.&@.@...
.Q.
.Q..A.V....T=b............
:...h..y
19:38:41.953971 IP 10.0.81.207.vcom-tunnel > 10.0.81.223.49494: Flags [P.], seq 17818:17820, ack 67, win 508, options [nop,nop,TS val 975094474 ecr 1753914745], length 2
E..6.'@.@...
.Q.
.Q..A.V....T=b............
:...h..y..
19:38:41.954068 IP 10.0.81.223.49494 > 10.0.81.207.vcom-tunnel: Flags [.], ack 17820, win 2048, options [nop,nop,TS val 1753915745 ecr 975094474], length 0
E..4..@.@...
.Q.
.Q..V.AT=b................
h..a:...
19:38:41.954197 IP 10.0.81.223.49494 > 10.0.81.207.vcom-tunnel: Flags [P.], seq 67:73, ack 17820, win 2048, options [nop,nop,TS val 1753915745 ecr 975094474], length 6
E..:..@.@...
.Q.
.Q..V.AT=b................
h..a:.........
19:38:41.954551 IP 10.0.81.207.vcom-tunnel > 10.0.81.223.49494: Flags [.], ack 73, win 508, options [nop,nop,TS val 975094474 ecr 1753915745], length 0
E..4.(@.@...
.Q.
.Q..A.V....T=b............
:...h..a
19:38:42.953620 IP 10.0.81.207.vcom-tunnel > 10.0.81.223.49494: Flags [P.], seq 17820:17822, ack 73, win 508, options [nop,nop,TS val 975095473 ecr 1753915745], length 2
E..6.)@.@...
.Q.
.Q..A.V....T=b............
:...h..a..
19:38:42.953780 IP 10.0.81.223.49494 > 10.0.81.207.vcom-tunnel: Flags [.], ack 17822, win 2048, options [nop,nop,TS val 1753916744 ecr 975095473], length 0
E..4..@.@...
.Q.
.Q..V.AT=b................
h..H:...
19:38:42.953951 IP 10.0.81.223.49494 > 10.0.81.207.vcom-tunnel: Flags [P.], seq 73:79, ack 17822, win 2048, options [nop,nop,TS val 1753916745 ecr 975095473], length 6
E..:..@.@...
.Q.
.Q..V.AT=b................
h..I:.....Q9..
19:38:42.954292 IP 10.0.81.207.vcom-tunnel > 10.0.81.223.49494: Flags [.], ack 79, win 508, options [nop,nop,TS val 975095474 ecr 1753916745], length 0
E..4.*@.@...
.Q.
.Q..A.V....T=b......5.....
:...h..I
19:38:43.953508 IP 10.0.81.207.vcom-tunnel > 10.0.81.223.49494: Flags [P.], seq 17822:17824, ack 79, win 508, options [nop,nop,TS val 975096473 ecr 1753916745], length 2
E..6.+@.@...
.Q.
.Q..A.V....T=b......D.....
:...h..I..
19:38:43.953570 IP 10.0.81.223.49494 > 10.0.81.207.vcom-tunnel: Flags [.], ack 17824, win 2048, options [nop,nop,TS val 1753917744 ecr 975096473], length 0
E..4..@.@...
.Q.
.Q..V.AT=b................
h..0:...
19:38:43.953632 IP 10.0.81.223.49494 > 10.0.81.207.vcom-tunnel: Flags [P.], seq 79:85, ack 17824, win 2048, options [nop,nop,TS val 1753917744 ecr 975096473], length 6
E..:..@.@...
.Q.
.Q..V.AT=b................
h..0:....."...
19:38:43.953935 IP 10.0.81.207.vcom-tunnel > 10.0.81.223.49494: Flags [.], ack 85, win 508, options [nop,nop,TS val 975096473 ecr 1753917744], length 0
E..4.,@.@...
.Q.
.Q..A.V....T=b#....._.....
:...h..0
19:38:44.954172 IP 10.0.81.207.vcom-tunnel > 10.0.81.223.49494: Flags [P.], seq 17824:17826, ack 85, win 508, options [nop,nop,TS val 975097474 ecr 1753917744], length 2
E..6.-@.@...
.Q.
.Q..A.V....T=b#.....l.....
:...h..0..
19:38:44.954308 IP 10.0.81.223.49494 > 10.0.81.207.vcom-tunnel: Flags [.], ack 17826, win 2048, options [nop,nop,TS val 1753918745 ecr 975097474], length 0
E..4..@.@...
.Q.
.Q..V.AT=b#...............
h...:...
19:38:44.954400 IP 10.0.81.223.49494 > 10.0.81.207.vcom-tunnel: Flags [P.], seq 85:91, ack 17826, win 2048, options [nop,nop,TS val 1753918745 ecr 975097474], length 6
E..:..@.@...
.Q.
.Q..V.AT=b#...............
h...:........8
19:38:44.954730 IP 10.0.81.207.vcom-tunnel > 10.0.81.223.49494: Flags [.], ack 91, win 508, options [nop,nop,TS val 975097474 ecr 1753918745], length 0
E..4..@.@...
.Q.
.Q..A.V....T=b)...........
:...h...
19:38:45.954061 IP 10.0.81.207.vcom-tunnel > 10.0.81.223.49494: Flags [P.], seq 17826:17828, ack 91, win 508, options [nop,nop,TS val 975098473 ecr 1753918745], length 2
E..6./@.@...
.Q.
.Q..A.V....T=b)...........
:..ih.....
19:38:45.954147 IP 10.0.81.223.49494 > 10.0.81.207.vcom-tunnel: Flags [.], ack 17828, win 2048, options [nop,nop,TS val 1753919745 ecr 975098473], length 0
E..4..@.@...
.Q.
.Q..V.AT=b)...............
h...:..i
19:38:45.954286 IP 10.0.81.223.49494 > 10.0.81.207.vcom-tunnel: Flags [P.], seq 91:97, ack 17828, win 2048, options [nop,nop,TS val 1753919745 ecr 975098473], length 6
E..:..@.@...
.Q.
.Q..V.AT=b)...............
h...:..i...%[.
