tcpdump: data link type PKTAP
tcpdump: verbose output suppressed, use -v[v]... for full protocol decode
listening on any, link-type PKTAP (Apple DLT_PKTAP), snapshot length 524288 bytes
20:15:45.233862 IP 10.0.81.207.vcom-tunnel > 10.0.81.223.49765: Flags [P.], seq 4231368382:4231368384, ack 271724995, win 508, options [nop,nop,TS val 977317717 ecr 538654448], length 2
E..6ea@.@...
.Q.
.Q..A.e.5...21.....D......
:@.U .6...
20:15:45.234018 IP 10.0.81.223.49765 > 10.0.81.207.vcom-tunnel: Flags [.], ack 2, win 2048, options [nop,nop,TS val 538655448 ecr 977317717], length 0
E..4..@.@...
.Q.
.Q..e.A.21..5.............
 .:.:@.U
20:15:45.234201 IP 10.0.81.223.49765 > 10.0.81.207.vcom-tunnel: Flags [P.], seq 1:7, ack 2, win 2048, options [nop,nop,TS val 538655448 ecr 977317717], length 6
E..:..@.@...
.Q.
.Q..e.A.21..5.............
 .:.:@.U....v.
20:15:45.234572 IP 10.0.81.207.vcom-tunnel > 10.0.81.223.49765: Flags [.], ack 7, win 508, options [nop,nop,TS val 977317718 ecr 538655448], length 0
E..4eb@.@...
.Q.
.Q..A.e.5...21............
:@.V .:.
20:15:46.234059 IP 10.0.81.207.vcom-tunnel > 10.0.81.223.49765: Flags [P.], seq 2:4, ack 7, win 508, options [nop,nop,TS val 977318718 ecr 538655448], length 2
E..6ec@.@...
.Q.
.Q..A.e.5...21.....<......
:@.> .:...
20:15:46.234154 IP 10.0.81.223.49765 > 10.0.81.207.vcom-tunnel: Flags [.], ack 4, win 2048, options [nop,nop,TS val 538656448 ecr 977318718], length 0
E..4..@.@...
.Q.
.Q..e.A.21..5.............
 .>.:@.>
20:15:46.234208 IP 10.0.81.223.49765 > 10.0.81.207.vcom-tunnel: Flags [P.], seq 7:13, ack 4, win 2048, options [nop,nop,TS val 538656448 ecr 977318718], length 6
E..:..@.@...
.Q.
.Q..e.A.21..5.............
 .>.:@.>...B.{
20:15:46.234608 IP 10.0.81.207.vcom-tunnel > 10.0.81.223.49765: Flags [.], ack 13, win 508, options [nop,nop,TS val 977318718 ecr 538656448], length 0
E..4ed@.@...
.Q.
.Q..A.e.5...21............
:@.> .>.
20:15:47.233852 IP 10.0.81.207.vcom-tunnel > 10.0.81.223.49765: Flags [P.], seq 4:6, ack 13, win 508, options [nop,nop,TS val 977319718 ecr 538656448], length 2
E..6ee@.@...
.Q.
.Q..A.e.5...21.....5&.....
:@.& .>...
20:15:47.233932 IP 10.0.81.223.49765 > 10.0.81.207.vcom-tunnel: Flags [.], ack 6, win 2048, options [nop,nop,TS val 538657448 ecr 977319718], length 0
E..4..@.@...
.Q.
.Q..e.A.21..5.............
 .B.:@.&
20:15:47.234067 IP 10.0.81.223.49765 > 10.0.81.207.vcom-tunnel: Flags [P.], seq 13:19, ack 6, win 2048, options [nop,nop,TS val 538657448 ecr 977319718], length 6
E..:..@.@...
.Q.
.Q..e.A.21..5.............
 .B.:@.&..._U.
20:15:47.234419 IP 10.0.81.207.vcom-tunnel > 10.0.81.223.49765: Flags [.], ack 19, win 508, options [nop,nop,TS val 977319718 ecr 538657448], length 0
E..4ef@.@...
.Q.
.Q..A.e.5...21......@.....
:@.& .B.
20:15:48.233407 IP 10.0.81.207.vcom-tunnel > 10.0.81.223.49765: Flags [P.], seq 6:8, ack 19, win 508, options [nop,nop,TS val 977320717 ecr 538657448], length 2
E..6eg@.@...
.Q.
.Q..A.e.5...21.....-O.....
:@.. .B...
20:15:48.233479 IP 10.0.81.223.49765 > 10.0.81.207.vcom-tunnel: Flags [.], ack 8, win 2048, options [nop,nop,TS val 538658447 ecr 977320717], length 0
E..4..@.@...
.Q.
.Q..e.A.21..5.............
 .F.:@.
20:15:48.233600 IP 10.0.81.223.49765 > 10.0.81.207.vcom-tunnel: Flags [P.], seq 19:25, ack 8, win 2048, options [nop,nop,TS val 538658447 ecr 977320717], length 6
E..:..@.@...
.Q.
.Q..e.A.21..5.............
 .F.:@....~..x
20:15:48.233929 IP 10.0.81.207.vcom-tunnel > 10.0.81.223.49765: Flags [.], ack 25, win 508, options [nop,nop,TS val 977320718 ecr 538658447], length 0
E..4eh@.@...
.Q.
.Q..A.e.5...21......i.....
:@.. .F.
20:15:49.234107 IP 10.0.81.207.vcom-tunnel > 10.0.81.223.49765: Flags [P.], seq 8:10, ack 25, win 508, options [nop,nop,TS val 977321718 ecr 538658447], length 2
E..6ei@.@...
.Q.
.Q..A.e.5...21.....%w.....
:@.. .F...
20:15:49.234205 IP 10.0.81.223.49765 > 10.0.81.207.vcom-tunnel: Flags [.], ack 10, win 2048, options [nop,nop,TS val 538659448 ecr 977321718], length 0
E..4..@.@...
.Q.
.Q..e.A.21..5.............
 .Jx:@..
20:15:49.234346 IP 10.0.81.223.49765 > 10.0.81.207.vcom-tunnel: Flags [P.], seq 25:31, ack 10, win 2048, options [nop,nop,TS val 538659448 ecr 977321718], length 6
E..:..@.@...
.Q.
.Q..e.A.21..5.............
 .Jx:@...."r..
20:15:49.234718 IP 10.0.81.207.vcom-tunnel > 10.0.81.223.49765: Flags [.], ack 31, win 508, options [nop,nop,TS val 977321718 ecr 538659448], length 0
E..4ej@.@...
.Q.
.Q..A.e.5...21............
:@.. .Jx
20:15:50.233323 IP 10.0.81.207.vcom-tunnel > 10.0.81.223.49765: Flags [P.], seq 10:12, ack 31, win 508, options [nop,nop,TS val 977322717 ecr 538659448], length 2
E..6ek@.@...
.Q.
.Q..A.e.5...21............
:@.. .Jx..
20:15:50.233394 IP 10.0.81.223.49765 > 10.0.81.207.vcom-tunnel: Flags [.], ack 12, win 2048, options [nop,nop,TS val 538660447 ecr 977322717], length 0
E..4..@.@...
.Q.
.Q..e.A.21..5.............
 .N_:@..
20:15:50.233525 IP 10.0.81.223.49765 > 10.0.81.207.vcom-tunnel: Flags [P.], seq 31:37, ack 12, win 2048, options [nop,nop,TS val 538660447 ecr 977322717], length 6
E..:..@.@...
.Q.
.Q..e.A.21..5.............
 .N_:@....Oa..
20:15:50.233853 IP 10.0.81.207.vcom-tunnel > 10.0.81.223.49765: Flags [.], ack 37, win 508, options [nop,nop,TS val 977322717 ecr 538660447], length 0
E..4el@.@...
.Q.
.Q..A.e.5...21............
:@.. .N_
20:15:51.233416 IP 10.0.81.207.vcom-tunnel > 10.0.81.223.49765: Flags [P.], seq 12:14, ack 37, win 508, options [nop,nop,TS val 977323717 ecr 538660447], length 2
E..6em@.@...
.Q.
.Q..A.e.5...21............
:@.. .N_..
20:15:51.233482 IP 10.0.81.223.49765 > 10.0.81.207.vcom-tunnel: Flags [.], ack 14, win 2048, options [nop,nop,TS val 538661447 ecr 977323717], length 0
E..4..@.@...
.Q.
.Q..e.A.21..5.............
 .RG:@..
20:15:51.233528 IP 10.0.81.223.49765 > 10.0.81.207.vcom-tunnel: Flags [P.], seq 37:43, ack 14, win 2048, options [nop,nop,TS val 538661447 ecr 977323717], length 6
E..:..@.@...
.Q.
.Q..e.A.21..5.............
 .RG:@........
20:15:51.233924 IP 10.0.81.207.vcom-tunnel > 10.0.81.223.49765: Flags [.], ack 43, win 508, options [nop,nop,TS val 977323718 ecr 538661447], length 0
E..4en@.@...
.Q.
.Q..A.e.5...21............
:@.. .RG
20:15:52.233820 IP 10.0.81.207.vcom-tunnel > 10.0.81.223.49765: Flags [P.], seq 14:16, ack 43, win 508, options [nop,nop,TS val 977324717 ecr 538661447], length 2
E..6eo@.@...
.Q.
.Q..A.e.5...21............
:@.. .RG..
20:15:52.234005 IP 10.0.81.223.49765 > 10.0.81.207.vcom-tunnel: Flags [.], ack 16, win 2048, options [nop,nop,TS val 538662448 ecr 977324717], length 0
E..4..@.@...
.Q.
.Q..e.A.21..5.............
 .V0:@..
20:15:52.234201 IP 10.0.81.223.49765 > 10.0.81.207.vcom-tunnel: Flags [P.], seq 43:49, ack 16, win 2048, options [nop,nop,TS val 538662448 ecr 977324717], length 6
E..:..@.@...
.Q.
.Q..e.A.21..5.............
 .V0:@.....E..
20:15:52.234530 IP 10.0.81.207.vcom-tunnel > 10.0.81.223.49765: Flags [.], ack 49, win 508, options [nop,nop,TS val 977324718 ecr 538662448], length 0
E..4ep@.@...
.Q.
.Q..A.e.5...21............
:@.. .V0
20:15:53.233856 IP 10.0.81.207.vcom-tunnel > 10.0.81.223.49765: Flags [P.], seq 16:18, ack 49, win 508, options [nop,nop,TS val 977325717 ecr 538662448], length 2
E..6eq@.@...
.Q.
.Q..A.e.5...21............
:@.. .V0..
20:15:53.233919 IP 10.0.81.223.49765 > 10.0.81.207.vcom-tunnel: Flags [.], ack 18, win 2048, options [nop,nop,TS val 538663448 ecr 977325717], length 0
E..4..@.@...
.Q.
.Q..e.A.21..5.............
 .Z.:@..
20:15:53.233972 IP 10.0.81.223.49765 > 10.0.81.207.vcom-tunnel: Flags [P.], seq 49:55, ack 18, win 2048, options [nop,nop,TS val 538663448 ecr 977325717], length 6
E..:..@.@...
.Q.
.Q..e.A.21..5.............
 .Z.:@........
20:15:53.234400 IP 10.0.81.207.vcom-tunnel > 10.0.81.223.49765: Flags [.], ack 55, win 508, options [nop,nop,TS val 977325718 ecr 538663448], length 0
E..4er@.@...
.Q.
.Q..A.e.5...21......0.....
:@.. .Z.
20:15:54.233837 IP 10.0.81.207.vcom-tunnel > 10.0.81.223.49765: Flags [P.], seq 18:20, ack 55, win 508, options [nop,nop,TS val 977326717 ecr 538663448], length 2
E..6es@.@...
.Q.
.Q..A.e.5...21......>.....
:@.} .Z...
20:15:54.233907 IP 10.0.81.223.49765 > 10.0.81.207.vcom-tunnel: Flags [.], ack 20, win 2048, options [nop,nop,TS val 538664448 ecr 977326717], length 0
E..4..@.@...
.Q.
.Q..e.A.21..5.............
 .^.:@.}
20:15:54.233947 IP 10.0.81.223.49765 > 10.0.81.207.vcom-tunnel: Flags [P.], seq 55:61, ack 20, win 2048, options [nop,nop,TS val 538664448 ecr 977326717], length 6
E..:..@.@...
.Q.
.Q..e.A.21..5.............
 .^.:@.}....Mc
20:15:54.234378 IP 10.0.81.207.vcom-tunnel > 10.0.81.223.49765: Flags [.], ack 61, win 508, options [nop,nop,TS val 977326718 ecr 538664448], length 0
E..4et@.@...
.Q.
.Q..A.e.5...21......X.....
:@.~ .^.
20:15:55.233707 IP 10.0.81.207.vcom-tunnel > 10.0.81.223.49765: Flags [P.], seq 20:22, ack 61, win 508, options [nop,nop,TS val 977327717 ecr 538664448], length 2
E..6eu@.@...
.Q.
.Q..A.e.5...21......f.....
:@.e .^...
20:15:55.233810 IP 10.0.81.223.49765 > 10.0.81.207.vcom-tunnel: Flags [.], ack 22, win 2048, options [nop,nop,TS val 538665448 ecr 977327717], length 0
E..4..@.@...
.Q.
.Q..e.A.21..5.............
 .a.:@.e
20:15:55.233957 IP 10.0.81.223.49765 > 10.0.81.207.vcom-tunnel: Flags [P.], seq 61:67, ack 22, win 2048, options [nop,nop,TS val 538665448 ecr 977327717], length 6
E..:..@.@...
.Q.
.Q..e.A.21..5.............
 .a.:@.e......
20:15:55.234327 IP 10.0.81.207.vcom-tunnel > 10.0.81.223.49765: Flags [.], ack 67, win 508, options [nop,nop,TS val 977327718 ecr 538665448], length 0
E..4ev@.@...
.Q.
.Q..A.e.5...22.....{......
:@.f .a.
20:15:56.234221 IP 10.0.81.207.vcom-tunnel > 10.0.81.223.49765: Flags [P.], seq 22:24, ack 67, win 508, options [nop,nop,TS val 977328718 ecr 538665448], length 2
E..6ew@.@...
.Q.
.Q..A.e.5...22............
:@.N .a...
20:15:56.234344 IP 10.0.81.223.49765 > 10.0.81.207.vcom-tunnel: Flags [.], ack 24, win 2048, options [nop,nop,TS val 538666448 ecr 977328718], length 0
E..4..@.@...
.Q.
.Q..e.A.22..5.............
 .e.:@.N
20:15:56.234475 IP 10.0.81.223.49765 > 10.0.81.207.vcom-tunnel: Flags [P.], seq 67:73, ack 24, win 2048, options [nop,nop,TS val 538666448 ecr 977328718], length 6
E..:..@.@...
.Q.
.Q..e.A.22..5.............
 .e.:@.N...h..
20:15:56.234765 IP 10.0.81.207.vcom-tunnel > 10.0.81.223.49765: Flags [.], ack 73, win 508, options [nop,nop,TS val 977328718 ecr 538666448], length 0
E..4ex@.@...
.Q.
.Q..A.e.5...22.....s......
:@.N .e.
20:15:56.910211 IP 10.0.81.223.50129 > 10.0.81.207.vcom-tunnel: Flags [SEW], seq 4115316460, win 65535, options [mss 1460,nop,wscale 6,nop,nop,TS val 2783134682 ecr 0,sackOK,eol], length 0
E..@..@.@...
.Q.
.Q....A.J.........................
..C.........
20:15:56.910812 IP 10.0.81.207.vcom-tunnel > 10.0.81.223.50129: Flags [S.E], seq 669707182, ack 4115316461, win 65160, options [mss 1460,sackOK,TS val 977329394 ecr 2783134682,nop,wscale 7], length 0
E..<..@.@...
.Q.
.Q..A..'....J...R.............
:@....C.....
20:15:56.910917 IP 10.0.81.223.50129 > 10.0.81.207.vcom-tunnel: Flags [.], ack 1, win 2059, options [nop,nop,TS val 2783134683 ecr 977329394], length 0
E..4..@.@...
.Q.
.Q....A.J..'..............
..C.:@..
20:15:56.911734 IP 10.0.81.223.50129 > 10.0.81.207.vcom-tunnel: Flags [P.], seq 1:110, ack 1, win 2059, options [nop,nop,TS val 2783134684 ecr 977329394], length 109
E.....@.@...
.Q.
.Q....A.J..'........A.....
..C.:@..GET /api/v1/device/hw HTTP/1.1
Content-Type: application/json
Connection: close
Host: 10.0.81.207:8001


20:15:56.912437 IP 10.0.81.207.vcom-tunnel > 10.0.81.223.50129: Flags [.], ack 110, win 509, options [nop,nop,TS val 977329396 ecr 2783134684], length 0
E..4s.@.@..F
.Q.
.Q..A..'....J.Z...........
:@....C.
20:15:56.943049 IP 10.0.81.207.vcom-tunnel > 10.0.81.223.50129: Flags [.], seq 1:1449, ack 110, win 509, options [nop,nop,TS val 977329426 ecr 2783134684], length 1448
E...s.@.@.	.
.Q.
.Q..A..'....J.Z.....k.....
:@....C.HTTP/1.1 200 OK
Date: Wed, 11 Mar 2026 19:15:56 GMT
Content-Type: application/json
Content-Length: 6486
X-Request-Id: 9ea9a5e6-86d9-41e9-835b-277eb3db757d
Vary: Origin
Access-Control-Allow-Origin: 
Access-Control-Allow-Credentials: true
Connection: close

{"code":0,"data":{"name":"MX6000 Pro","customName":"MX6000 Pro_0006CC","modelID":5377,"sn":"00325901000006CC","thirdPartySn":"00325901000006CC","thirdPartySerial":"00325901000006CC","mac":"54:b5:6c:1a:c9:ce","type":"G3.5","netPortBandWidth":0,"hwVersion":"V1.5.0","swVersion":"","mcuVersion":"23_0620_210800","fpgaVersion":"2024.03.24 FPGA_A_GOLDEN V1.1.0.0.180020","mcuVersionRemark":"23_0620_210800","fpgaVersionRemark":"2024.03.24 FPGA_A_GOLDEN V1.1.0.0.180020","softVersion":{"Package":"","Version":"","Architecture":"","Maintainer":"","Description":""},"configVersion":"V1.4.0.1","ip":"10.0.81.207","WirelessIpAddress":"no Wire Ip","mode":2,"companyName":"","capability":{"deviceType":1,"systemLatency":false,"processing":true,"schedule":true,"rotation":false,"mirror":false,"3D":true,"multiUserThreeD":false,"multiUserThreeDNum":null,"threeDFrame":false,"threeDSource":[0,1,2],"threeDFrameList":[],"hideThreeDRightOffset":false,"CabinetManagementTool":true,"HDR10":true,"inputBackup":false,"sync":true,"genLock":true,"frameRateMultiplication":true,"shutterSync":true,"photoelectricConversion":true,"lowLatency":true,"additionalFrameDelay":true,"blackLevel":true,"baseImageCoun
20:15:56.943054 IP 10.0.81.207.vcom-tunnel > 10.0.81.223.50129: Flags [.], seq 1449:2897, ack 110, win 509, options [nop,nop,TS val 977329426 ecr 2783134684], length 1448
E...s.@.@.	.
.Q.
.Q..A..'..W.J.Z.....G.....
:@....C.t":2,"inputZoom":false,"negPosSupport":true,"maxCapacity":31457280,"presetImage":true,"abnormalImage":true,"customTestImage":true,"inputImageEcho":true,"outputImageEcho":true,"HDCP":false,"limitToFull":false,"highLights":true,"shadow":true,"signalTransmitter":false,"ABL":false,"EDE":false,"ITMO":false,"colorReplace":true,"colorCalibration":true,"systemRestore":false,"3DLUT":true,"PIP":false,"CSC":true,"inputAutoSwitch":false,"curtainOverspread":false,"ipem":false,"hdmiModeSetting":false,"frameRemaping":true,"curve":true,"noVideoSignal":false,"maxWidth":30720,"maxHeight":24000,"presetImageMaxNum":4,"outputBitDepth":[0,1,2,255],"bitDepth":255,"internalBitDepths":[0,1,2],"colorSpaceType":[0,1,2,255],"colorGamutType":[2,3,4,255],"mosaic":{"mode":[{"value":0,"comment":"1x1","inputType":[3,9]},{"value":0,"comment":"","inputType":[3,9]},{"value":0,"comment":"","inputType":[3,9]},{"value":3,"comment":"1x4","inputType":[3,9]},{"value":0,"comment":"","inputType":[3,9]},{"value":5,"comment":"2x2","inputType":[3,9]},{"value":0,"comment":"","inputType":[3,9]},{"value":7,"comment":"4x1","inputType":[3,9]}]},"presetImageSize":{"width":3840,"height":2160},"presetImageSetInfo":{"maxWidth":8192,"maxHeight":8192},"additionalFrameDelayRange":{"min":0,"max":2,"step":1},"frameRateMultiplicationRange":{"min":2,"max":6,"step":1},"threeDRightEyeOffsetRange":{"min":0,"max":8192,"step":1},"hwMonitor":{"armSupported":false,"fanSupported":true,"fpgaSupp
20:15:56.943058 IP 10.0.81.207.vcom-tunnel > 10.0.81.223.50129: Flags [P.], seq 2897:4097, ack 110, win 509, options [nop,nop,TS val 977329426 ecr 2783134684], length 1200
E...s.@.@.
.
.Q.
.Q..A..'....J.Z.....
.....
:@....C.orted":true,"inputSubCardSupported":false,"mainBordSupported":false,"netWorkSubCardSupported":false,"opticalCardSupported":false},"virtualMode":null,"videoController":false,"defaultCurtainSize":{"width":3840,"height":2160},"maxCurtainSize":{"width":16384,"height":16384},"minCurtainSize":{"width":256,"height":256},"layerNumberLimit":4,"supportSizeList":{"mode":[{"width":8192,"height":2160},{"width":4096,"height":4320},{"width":4096,"height":2160},{"width":3840,"height":2160},{"width":3840,"height":1080},{"width":1920,"height":1080}]},"maxCurtainArea":35389440,"maxCurtainCapacity":17694720,"maxLayerArea":4294967295,"modifyCurtainSize":true,"modifyLayerCoordinate":true,"modifyLayerSize":true,"supportLayerCut":true,"supportLayerBorder":true,"supportLayerZOrder":true,"minLayerSize":{"width":256,"height":256},"maxLayerSize":{"width":65535,"height":65535},"supportLayerStretch":true,"supportLayerOriginSize":true,"supportLayerScreenSize":true,"supportLayerFollow":true,"blackLevelOutPutBit":12,"cabinetsPainter":true,"maxSourceDefaultWidth":7680,"maxSourceDefaultHeight":4320,"channelNumber":4,"presetNameCheck":true,"customGamutNameChange":true,"customRate":true,"supportSourcecutTypes":null,"m
20:15:56.943072 IP 10.0.81.207.vcom-tunnel > 10.0.81.223.50129: Flags [.], seq 4097:5545, ack 110, win 509, options [nop,nop,TS val 977329427 ecr 2783134684], length 1448
E...s.@.@.	.
.Q.
.Q..A..'....J.Z.....".....
:@....C.inSourcecutResolutionProduct":0,"minSourcecutWidth":0,"minSourcecutHeight":0,"cinemaTxTest":false,"xyzTxTestPattern":false,"supportArtNetProtocol":false,"minFrameOffset":-16383,"maxFrameOffset":16383,"supportHDRSourceTypes":"AgMLBgUJERbA","upgradeMaxTimeout":1200000,"ncpManager":true,"layout":{"mode":[{"value":0,"comment":"0","minCurtainSize":{"width":256,"height":256},"step":{"width":1,"height":1}},{"value":1,"comment":"1x1","minCurtainSize":{"width":256,"height":256},"step":{"width":1,"height":1}},{"value":3,"comment":"1*2","minCurtainSize":{"width":512,"height":256},"step":{"width":2,"height":1}},{"value":5,"comment":"1*4","minCurtainSize":{"width":1024,"height":256},"step":{"width":4,"height":1}},{"value":6,"comment":"1*3","minCurtainSize":{"width":768,"height":256},"step":{"width":3,"height":1}}]},"presetNumber":128,"maxScreenNumber":8,"switchSourceType":0,"audioSources":null,"hwScreenNeedHandleProcessing":false,"supportCable":true,"systemBackup":true,"controllerPosition":false,"allowChangeWorkMode":true,"curtainManage":true,"dP14Mode":false,"internalSource":true,"outputSyncSource":false,"outputSyncInner":true,"phaseShift":true,"cabinetsStore":false,"controllerMaintenance":true,"cabinetMaintenance":false,"preset":true,"artNet":true,"artNetMaxStartAddressList":[190,193,510,512],"snmp":true,"userManual":false,"shortcutKey":false,"isSupportModifyOpticalMode":false,"frameRateTable":[23.98,24,25,29.97,30,47.95,48,50,59.94,60
20:15:56.943075 IP 10.0.81.207.vcom-tunnel > 10.0.81.223.50129: Flags [P.], seq 5545:6753, ack 110, win 509, options [nop,nop,TS val 977329427 ecr 2783134684], length 1208
E...s.@.@.
.
.Q.
.Q..A..'..W.J.Z...........
:@....C.,71.93,72,75,100,119.88,120,143.86,144,240],"supportPxToPx":true,"monitorType":0,"disableSetSystemTime":false,"lineHWScreenType":0,"layerDelete":true,"imageEnhance":false,"supportColorBeacon":true,"supportRGBWRatioAdjust":true,"isSupportGamutAsync":true,"correctSpeedVersion":"AQ==","NTP":true,"mfCardUpdate":true,"deviceLocation":true,"smartHWScreen":true,"firmwarePainter":true,"sdi12GCustomHDR10":true,"dPCustomHDR10":true,"isSupportCloud":true,"capabilityVersion":"V4.0.0"},"deviceWorkMode":0,"IpNetmask":"255.255.254.0","IpGateway":"10.0.80.1","ethMode":"","hostName":"","Dns":["1.1.1.1","8.8.8.8"],"dhcp":true,"configIP":"","Series":0,"uptime":639480,"memorySize":10749324288,"memoryUsed":5514064896,"memoryFree":5235259392,"subBoardInfo":{"inputSn":{"type":0,"sn":"","modelId":0},"sasaSn":{"type":0,"sn":"","modelId":0},"sasbSn":{"type":0,"sn":"","modelId":0},"qsfpSn":{"type":0,"sn":"","modelId":0}},"customIp":"","deviceUUID":"{9fa8508a-1521-4f33-89a1-64015cde8569}","groupName":"","isAllowSingleDev":false,"supportInputSubCardNum":8,"supportOutputSubCardNum":8,"encipher":{"vendorID":0,"authState":0,"authStartTime":"","authEndTime":"","isOverRange":false},"randomPassword":""},"message":"Success"}
20:15:56.943102 IP 10.0.81.223.50129 > 10.0.81.207.vcom-tunnel: Flags [.], ack 1449, win 2037, options [nop,nop,TS val 2783134715 ecr 977329426], length 0
E..4..@.@...
.Q.
.Q....A.J.Z'..W...........
..C.:@..
20:15:56.943124 IP 10.0.81.223.50129 > 10.0.81.207.vcom-tunnel: Flags [.], ack 2897, win 2015, options [nop,nop,TS val 2783134715 ecr 977329426], length 0
E..4..@.@...
.Q.
.Q....A.J.Z'..............
..C.:@..
20:15:56.943134 IP 10.0.81.223.50129 > 10.0.81.207.vcom-tunnel: Flags [.], ack 4097, win 1997, options [nop,nop,TS val 2783134715 ecr 977329426], length 0
E..4..@.@...
.Q.
.Q....A.J.Z'..............
..C.:@..
20:15:56.943141 IP 10.0.81.223.50129 > 10.0.81.207.vcom-tunnel: Flags [.], ack 4097, win 2048, options [nop,nop,TS val 2783134715 ecr 977329426], length 0
E..4..@.@...
.Q.
.Q....A.J.Z'..............
..C.:@..
20:15:56.943149 IP 10.0.81.223.50129 > 10.0.81.207.vcom-tunnel: Flags [.], ack 5545, win 2026, options [nop,nop,TS val 2783134715 ecr 977329427], length 0
E..4..@.@...
.Q.
.Q....A.J.Z'..W...........
..C.:@..
20:15:56.943155 IP 10.0.81.223.50129 > 10.0.81.207.vcom-tunnel: Flags [.], ack 6753, win 2008, options [nop,nop,TS val 2783134715 ecr 977329427], length 0
E..4..@.@...
.Q.
.Q....A.J.Z'..............
..C.:@..
20:15:56.943198 IP 10.0.81.207.vcom-tunnel > 10.0.81.223.50129: Flags [F.], seq 6753, ack 110, win 509, options [nop,nop,TS val 977329427 ecr 2783134684], length 0
E..4s.@.@..@
.Q.
.Q..A..'....J.Z.....J.....
:@....C.
20:15:56.943215 IP 10.0.81.223.50129 > 10.0.81.207.vcom-tunnel: Flags [.], ack 6754, win 2008, options [nop,nop,TS val 2783134715 ecr 977329427], length 0
E..4..@.@...
.Q.
.Q....A.J.Z'..............
..C.:@..
20:15:56.944732 IP 10.0.81.223.50129 > 10.0.81.207.vcom-tunnel: Flags [F.], seq 110, ack 6754, win 2048, options [nop,nop,TS val 2783134717 ecr 977329427], length 0
E..4..@.@...
.Q.
.Q....A.J.Z'..............
..C.:@..
20:15:56.945095 IP 10.0.81.207.vcom-tunnel > 10.0.81.223.50129: Flags [.], ack 111, win 509, options [nop,nop,TS val 977329429 ecr 2783134717], length 0
E..4..@.@...
.Q.
.Q..A..'....J.[.....&.....
:@....C.
20:15:57.234280 IP 10.0.81.207.vcom-tunnel > 10.0.81.223.49765: Flags [P.], seq 24:26, ack 73, win 508, options [nop,nop,TS val 977329718 ecr 538666448], length 2
E..6ey@.@...
.Q.
.Q..A.e.5...22............
:@.6 .e...
20:15:57.234391 IP 10.0.81.223.49765 > 10.0.81.207.vcom-tunnel: Flags [.], ack 26, win 2048, options [nop,nop,TS val 538667448 ecr 977329718], length 0
E..4..@.@...
.Q.
.Q..e.A.22..5.............
 .i.:@.6
20:15:57.234526 IP 10.0.81.223.49765 > 10.0.81.207.vcom-tunnel: Flags [P.], seq 73:79, ack 26, win 2048, options [nop,nop,TS val 538667448 ecr 977329718], length 6
E..:..@.@...
.Q.
.Q..e.A.22..5.............
 .i.:@.6.....0
20:15:57.234847 IP 10.0.81.207.vcom-tunnel > 10.0.81.223.49765: Flags [.], ack 79, win 508, options [nop,nop,TS val 977329718 ecr 538667448], length 0
E..4ez@.@...
.Q.
.Q..A.e.5...22.....k......
:@.6 .i.
20:15:58.233479 IP 10.0.81.207.vcom-tunnel > 10.0.81.223.49765: Flags [P.], seq 26:28, ack 79, win 508, options [nop,nop,TS val 977330717 ecr 538667448], length 2
E..6e{@.@...
.Q.
.Q..A.e.5...22............
:@.. .i...
20:15:58.233570 IP 10.0.81.223.49765 > 10.0.81.207.vcom-tunnel: Flags [.], ack 28, win 2048, options [nop,nop,TS val 538668447 ecr 977330717], length 0
E..4..@.@...
.Q.
.Q..e.A.22..5.............
 .m.:@..
20:15:58.233626 IP 10.0.81.223.49765 > 10.0.81.207.vcom-tunnel: Flags [P.], seq 79:85, ack 28, win 2048, options [nop,nop,TS val 538668447 ecr 977330717], length 6
E..:..@.@...
.Q.
.Q..e.A.22..5.............
 .m.:@.....A..
20:15:58.233989 IP 10.0.81.207.vcom-tunnel > 10.0.81.223.49765: Flags [.], ack 85, win 508, options [nop,nop,TS val 977330718 ecr 538668447], length 0
E..4e|@.@...
.Q.
.Q..A.e.5...22.....c......
:@.. .m.
20:15:59.233838 IP 10.0.81.207.vcom-tunnel > 10.0.81.223.49765: Flags [P.], seq 28:30, ack 85, win 508, options [nop,nop,TS val 977331717 ecr 538668447], length 2
E..6e}@.@...
.Q.
.Q..A.e.5...22............
:@.. .m...
20:15:59.233926 IP 10.0.81.223.49765 > 10.0.81.207.vcom-tunnel: Flags [.], ack 30, win 2048, options [nop,nop,TS val 538669448 ecr 977331717], length 0
E..4..@.@...
.Q.
.Q..e.A.22..5.............
 .q.:@..
20:15:59.234020 IP 10.0.81.223.49765 > 10.0.81.207.vcom-tunnel: Flags [P.], seq 85:91, ack 30, win 2048, options [nop,nop,TS val 538669448 ecr 977331717], length 6
E..:..@.@...
.Q.
.Q..e.A.22..5.............
 .q.:@........
20:15:59.234359 IP 10.0.81.207.vcom-tunnel > 10.0.81.223.49765: Flags [.], ack 91, win 508, options [nop,nop,TS val 977331718 ecr 538669448], length 0
E..4e~@.@...
.Q.
.Q..A.e.5...22.....\ .....
:@.. .q.
20:15:59.432090 IP 10.0.81.207.vcom-tunnel > 10.0.81.223.49765: Flags [P.], seq 30:1058, ack 91, win 508, options [nop,nop,TS val 977331916 ecr 538669448], length 1028
E..8e.@.@...
.Q.
.Q..A.e.5...22......3.....
:@.. .q..~..{"eventData":{"name":"MX6000 Pro_0006CC","runtime":639480,"totalRuntime":987120,"mainBoardTemperature":{"value":41,"status":0,"name":".....................","nameEn":"Mainboard Temperature"},"mainBoardVoltage":{"value":12.31,"status":0,"name":"..................","nameEn":"Mainboard Voltage"},"backupStatus":{"status":0,"errCode":108,"minNormalValue":0,"maxNormalValue":0},"fanInfos":[{"fanSpeed":3000,"fanType":16,"fanShowType":1,"fanName":"...............-1","fanNameEn":"Chassis Fan 1","status":0},{"fanSpeed":3030,"fanType":17,"fanShowType":1,"fanName":"...............-2","fanNameEn":"Chassis Fan 2","status":0},{"fanSpeed":3000,"fanType":18,"fanShowType":1,"fanName":"...............-3","fanNameEn":"Chassis Fan 3","status":0},{"fanSpeed":2970,"fanType":19,"fanShowType":2,"fanName":"...............-1","fanNameEn":"Chassis Fan 4","status":0},{"fanSpeed":3015,"fanType":20,"fanShowType":2,"fanName":"...............-2","fanNameEn":"Chassis Fan 5","status":0},{"fanSpeed":3045,"fanType":21,"fanShowType":2,"fanName":".
20:15:59.432163 IP 10.0.81.223.49765 > 10.0.81.207.vcom-tunnel: Flags [.], ack 1058, win 2048, options [nop,nop,TS val 538669646 ecr 977331916], length 0
E..4..@.@...
.Q.
.Q..e.A.22..5.............
 .rN:@..
20:15:59.432239 IP 10.0.81.207.vcom-tunnel > 10.0.81.223.49765: Flags [P.], seq 1058:1482, ack 91, win 508, options [nop,nop,TS val 977331916 ecr 538669448], length 424
E...e.@.@...
.Q.
.Q..A.e.5...22.....#......
:@.. .q...............-3","fanNameEn":"Chassis Fan 6","status":0}],"voltageInfos":null,"temperatureInfos":null,"powerMonitorInfos":[{"powerID":0,"status":0},{"powerID":1,"status":0}],"controllerPortMonitorInfos":[{"controllerPortID":0,"status":0},{"controllerPortID":1,"status":2}],"imbLinkStatus":{"linkStatus":false,"status":0},"timestamp":"2026-03-12 03:15:59"},"eventSender":"monitor","eventType":"controllerRealTimeInfoChange"}
20:15:59.432279 IP 10.0.81.223.49765 > 10.0.81.207.vcom-tunnel: Flags [.], ack 1482, win 2048, options [nop,nop,TS val 538669646 ecr 977331916], length 0
E..4..@.@...
.Q.
.Q..e.A.22..5.............
 .rN:@..
20:15:59.738156 IP 10.0.81.207.vcom-tunnel > 10.0.81.223.49765: Flags [P.], seq 1482:2502, ack 91, win 508, options [nop,nop,TS val 977332222 ecr 538669646], length 1020
E..0e.@.@...
.Q.
.Q..A.e.5...22.....-8.....
:@.. .rN.~..{"eventData":{"cabinetID":7540236129665029,"rvCardID":7540236129665029,"netPortIndex":2056,"cabinetIndex":5,"runtime":0,"totalRuntime":0,"temperature":{"value":46,"status":0,"name":"","nameEn":""},"voltage":{"value":4,"status":0,"name":"","nameEn":""},"humidity":{"value":0,"status":0,"name":"","nameEn":""},"errorBit":[{"value":0,"type":0,"status":0},{"value":0,"type":1,"status":0}],"signalInterruptCount":0,"backupStatus":{"mode":0,"status":0},"nextCabinetLinkStatus":{"linkStatus":true,"status":0},"phyTemperature":{"phy1":{"value":0,"status":0,"name":"","nameEn":""},"phy2":{"value":0,"status":0,"name":"","nameEn":""}},"moduleInfos":null,"cabinetMonitorInfo":{"cabinetID":0,"power":null,"temperature":{"value":0,"status":0,"name":"","nameEn":""},"humidity":{"value":0,"status":0,"name":"","nameEn":""},"smoke":{"value":0,"status":0,"name":"","nameEn":""},"voltage":{"value":4,"status":0,"name":"","nameEn":""}},"timestamp":"2026-03-12 03:15:59"},"eventSender":"monitor","eventType":"cabinetRealTimeInfoChange"}
20:15:59.738221 IP 10.0.81.223.49765 > 10.0.81.207.vcom-tunnel: Flags [.], ack 2502, win 2048, options [nop,nop,TS val 538669952 ecr 977332222], length 0
E..4..@.@...
.Q.
.Q..e.A.22..5.............
 .s.:@..
20:15:59.738549 IP 10.0.81.207.vcom-tunnel > 10.0.81.223.49765: Flags [P.], seq 2502:3522, ack 91, win 508, options [nop,nop,TS val 977332222 ecr 538669646], length 1020
E..0e.@.@...
.Q.
.Q..A.e.5...22.....&`.....
:@.. .rN.~..{"eventData":{"cabinetID":7540236130320391,"rvCardID":7540236130320391,"netPortIndex":2066,"cabinetIndex":7,"runtime":0,"totalRuntime":0,"temperature":{"value":46,"status":0,"name":"","nameEn":""},"voltage":{"value":4,"status":0,"name":"","nameEn":""},"humidity":{"value":0,"status":0,"name":"","nameEn":""},"errorBit":[{"value":0,"type":0,"status":0},{"value":0,"type":1,"status":0}],"signalInterruptCount":0,"backupStatus":{"mode":0,"status":0},"nextCabinetLinkStatus":{"linkStatus":true,"status":0},"phyTemperature":{"phy1":{"value":0,"status":0,"name":"","nameEn":""},"phy2":{"value":0,"status":0,"name":"","nameEn":""}},"moduleInfos":null,"cabinetMonitorInfo":{"cabinetID":0,"power":null,"temperature":{"value":0,"status":0,"name":"","nameEn":""},"humidity":{"value":0,"status":0,"name":"","nameEn":""},"smoke":{"value":0,"status":0,"name":"","nameEn":""},"voltage":{"value":4,"status":0,"name":"","nameEn":""}},"timestamp":"2026-03-12 03:15:59"},"eventSender":"monitor","eventType":"cabinetRealTimeInfoChange"}
20:15:59.738586 IP 10.0.81.223.49765 > 10.0.81.207.vcom-tunnel: Flags [.], ack 3522, win 2048, options [nop,nop,TS val 538669952 ecr 977332222], length 0
E..4..@.@...
.Q.
.Q..e.A.22..5.............
 .s.:@..
20:15:59.739096 IP 10.0.81.207.vcom-tunnel > 10.0.81.223.49765: Flags [P.], seq 3522:4542, ack 91, win 508, options [nop,nop,TS val 977332223 ecr 538669952], length 1020
E..0e.@.@...
.Q.
.Q..A.e.5...22.....4	.....
:@.. .s..~..{"eventData":{"cabinetID":7540236129271815,"rvCardID":7540236129271815,"netPortIndex":2050,"cabinetIndex":7,"runtime":0,"totalRuntime":0,"temperature":{"value":46,"status":0,"name":"","nameEn":""},"voltage":{"value":4,"status":0,"name":"","nameEn":""},"humidity":{"value":0,"status":0,"name":"","nameEn":""},"errorBit":[{"value":0,"type":0,"status":0},{"value":0,"type":1,"status":0}],"signalInterruptCount":0,"backupStatus":{"mode":0,"status":0},"nextCabinetLinkStatus":{"linkStatus":true,"status":0},"phyTemperature":{"phy1":{"value":0,"status":0,"name":"","nameEn":""},"phy2":{"value":0,"status":0,"name":"","nameEn":""}},"moduleInfos":null,"cabinetMonitorInfo":{"cabinetID":0,"power":null,"temperature":{"value":0,"status":0,"name":"","nameEn":""},"humidity":{"value":0,"status":0,"name":"","nameEn":""},"smoke":{"value":0,"status":0,"name":"","nameEn":""},"voltage":{"value":4,"status":0,"name":"","nameEn":""}},"timestamp":"2026-03-12 03:15:59"},"eventSender":"monitor","eventType":"cabinetRealTimeInfoChange"}
20:15:59.739128 IP 10.0.81.223.49765 > 10.0.81.207.vcom-tunnel: Flags [.], ack 4542, win 2048, options [nop,nop,TS val 538669953 ecr 977332223], length 0
E..4..@.@...
.Q.
.Q..e.A.22..5.|...........
 .s.:@..
20:15:59.739417 IP 10.0.81.207.vcom-tunnel > 10.0.81.223.49765: Flags [P.], seq 4542:5562, ack 91, win 508, options [nop,nop,TS val 977332223 ecr 538669952], length 1020
E..0e.@.@...
.Q.
.Q..A.e.5.|.22.....3......
:@.. .s..~..{"eventData":{"cabinetID":7540236129271812,"rvCardID":7540236129271812,"netPortIndex":2050,"cabinetIndex":4,"runtime":0,"totalRuntime":0,"temperature":{"value":47,"status":0,"name":"","nameEn":""},"voltage":{"value":4,"status":0,"name":"","nameEn":""},"humidity":{"value":0,"status":0,"name":"","nameEn":""},"errorBit":[{"value":0,"type":0,"status":0},{"value":0,"type":1,"status":0}],"signalInterruptCount":0,"backupStatus":{"mode":0,"status":0},"nextCabinetLinkStatus":{"linkStatus":true,"status":0},"phyTemperature":{"phy1":{"value":0,"status":0,"name":"","nameEn":""},"phy2":{"value":0,"status":0,"name":"","nameEn":""}},"moduleInfos":null,"cabinetMonitorInfo":{"cabinetID":0,"power":null,"temperature":{"value":0,"status":0,"name":"","nameEn":""},"humidity":{"value":0,"status":0,"name":"","nameEn":""},"smoke":{"value":0,"status":0,"name":"","nameEn":""},"voltage":{"value":4,"status":0,"name":"","nameEn":""}},"timestamp":"2026-03-12 03:15:59"},"eventSender":"monitor","eventType":"cabinetRealTimeInfoChange"}
20:15:59.739454 IP 10.0.81.223.49765 > 10.0.81.207.vcom-tunnel: Flags [.], ack 5562, win 2048, options [nop,nop,TS val 538669953 ecr 977332223], length 0
E..4..@.@...
.Q.
.Q..e.A.22..5.x...........
 .s.:@..
20:15:59.739791 IP 10.0.81.207.vcom-tunnel > 10.0.81.223.49765: Flags [P.], seq 5562:6582, ack 91, win 508, options [nop,nop,TS val 977332223 ecr 538669953], length 1020
E..0e.@.@...
.Q.
.Q..A.e.5.x.22..... ,.....
:@.. .s..~..{"eventData":{"cabinetID":7540236130254850,"rvCardID":7540236130254850,"netPortIndex":2065,"cabinetIndex":2,"runtime":0,"totalRuntime":0,"temperature":{"value":45,"status":0,"name":"","nameEn":""},"voltage":{"value":4,"status":0,"name":"","nameEn":""},"humidity":{"value":0,"status":0,"name":"","nameEn":""},"errorBit":[{"value":0,"type":0,"status":0},{"value":0,"type":1,"status":0}],"signalInterruptCount":0,"backupStatus":{"mode":0,"status":0},"nextCabinetLinkStatus":{"linkStatus":true,"status":0},"phyTemperature":{"phy1":{"value":0,"status":0,"name":"","nameEn":""},"phy2":{"value":0,"status":0,"name":"","nameEn":""}},"moduleInfos":null,"cabinetMonitorInfo":{"cabinetID":0,"power":null,"temperature":{"value":0,"status":0,"name":"","nameEn":""},"humidity":{"value":0,"status":0,"name":"","nameEn":""},"smoke":{"value":0,"status":0,"name":"","nameEn":""},"voltage":{"value":4,"status":0,"name":"","nameEn":""}},"timestamp":"2026-03-12 03:15:59"},"eventSender":"monitor","eventType":"cabinetRealTimeInfoChange"}
20:15:59.739819 IP 10.0.81.223.49765 > 10.0.81.207.vcom-tunnel: Flags [.], ack 6582, win 2048, options [nop,nop,TS val 538669954 ecr 977332223], length 0
E..4..@.@...
.Q.
.Q..e.A.22..5.t...........
 .s.:@..
20:15:59.740407 IP 10.0.81.207.vcom-tunnel > 10.0.81.223.49765: Flags [P.], seq 6582:7602, ack 91, win 508, options [nop,nop,TS val 977332224 ecr 538669954], length 1020
E..0e.@.@...
.Q.
.Q..A.e.5.t.22.....1......
:@.. .s..~..{"eventData":{"cabinetID":7540236129271808,"rvCardID":7540236129271808,"netPortIndex":2050,"cabinetIndex":0,"runtime":0,"totalRuntime":0,"temperature":{"value":46,"status":0,"name":"","nameEn":""},"voltage":{"value":4,"status":0,"name":"","nameEn":""},"humidity":{"value":0,"status":0,"name":"","nameEn":""},"errorBit":[{"value":0,"type":0,"status":0},{"value":0,"type":1,"status":0}],"signalInterruptCount":0,"backupStatus":{"mode":0,"status":0},"nextCabinetLinkStatus":{"linkStatus":true,"status":0},"phyTemperature":{"phy1":{"value":0,"status":0,"name":"","nameEn":""},"phy2":{"value":0,"status":0,"name":"","nameEn":""}},"moduleInfos":null,"cabinetMonitorInfo":{"cabinetID":0,"power":null,"temperature":{"value":0,"status":0,"name":"","nameEn":""},"humidity":{"value":0,"status":0,"name":"","nameEn":""},"smoke":{"value":0,"status":0,"name":"","nameEn":""},"voltage":{"value":4,"status":0,"name":"","nameEn":""}},"timestamp":"2026-03-12 03:15:59"},"eventSender":"monitor","eventType":"cabinetRealTimeInfoChange"}
20:15:59.740430 IP 10.0.81.223.49765 > 10.0.81.207.vcom-tunnel: Flags [.], ack 7602, win 2048, options [nop,nop,TS val 538669954 ecr 977332224], length 0
E..4..@.@...
.Q.
.Q..e.A.22..5.p...........
 .s.:@..
20:15:59.740782 IP 10.0.81.207.vcom-tunnel > 10.0.81.223.49765: Flags [P.], seq 7602:8622, ack 91, win 508, options [nop,nop,TS val 977332224 ecr 538669954], length 1020
E..0e.@.@...
.Q.
.Q..A.e.5.p.22......8.....
:@.. .s..~..{"eventData":{"cabinetID":7540236130123782,"rvCardID":7540236130123782,"netPortIndex":2063,"cabinetIndex":6,"runtime":0,"totalRuntime":0,"temperature":{"value":45,"status":0,"name":"","nameEn":""},"voltage":{"value":4,"status":0,"name":"","nameEn":""},"humidity":{"value":0,"status":0,"name":"","nameEn":""},"errorBit":[{"value":0,"type":0,"status":0},{"value":0,"type":1,"status":0}],"signalInterruptCount":0,"backupStatus":{"mode":0,"status":0},"nextCabinetLinkStatus":{"linkStatus":true,"status":0},"phyTemperature":{"phy1":{"value":0,"status":0,"name":"","nameEn":""},"phy2":{"value":0,"status":0,"name":"","nameEn":""}},"moduleInfos":null,"cabinetMonitorInfo":{"cabinetID":0,"power":null,"temperature":{"value":0,"status":0,"name":"","nameEn":""},"humidity":{"value":0,"status":0,"name":"","nameEn":""},"smoke":{"value":0,"status":0,"name":"","nameEn":""},"voltage":{"value":4,"status":0,"name":"","nameEn":""}},"timestamp":"2026-03-12 03:15:59"},"eventSender":"monitor","eventType":"cabinetRealTimeInfoChange"}
20:15:59.740807 IP 10.0.81.223.49765 > 10.0.81.207.vcom-tunnel: Flags [.], ack 8622, win 2048, options [nop,nop,TS val 538669955 ecr 977332224], length 0
E..4..@.@...
.Q.
.Q..e.A.22..5.l...........
 .s.:@..
20:15:59.741287 IP 10.0.81.207.vcom-tunnel > 10.0.81.223.49765: Flags [P.], seq 8622:9642, ack 91, win 508, options [nop,nop,TS val 977332225 ecr 538669955], length 1020
E..0e.@.@...
.Q.
.Q..A.e.5.l.22......).....
:@.. .s..~..{"eventData":{"cabinetID":7540236130451458,"rvCardID":7540236130451458,"netPortIndex":2068,"cabinetIndex":2,"runtime":0,"totalRuntime":0,"temperature":{"value":45,"status":0,"name":"","nameEn":""},"voltage":{"value":4,"status":0,"name":"","nameEn":""},"humidity":{"value":0,"status":0,"name":"","nameEn":""},"errorBit":[{"value":0,"type":0,"status":0},{"value":0,"type":1,"status":0}],"signalInterruptCount":0,"backupStatus":{"mode":0,"status":0},"nextCabinetLinkStatus":{"linkStatus":true,"status":0},"phyTemperature":{"phy1":{"value":0,"status":0,"name":"","nameEn":""},"phy2":{"value":0,"status":0,"name":"","nameEn":""}},"moduleInfos":null,"cabinetMonitorInfo":{"cabinetID":0,"power":null,"temperature":{"value":0,"status":0,"name":"","nameEn":""},"humidity":{"value":0,"status":0,"name":"","nameEn":""},"smoke":{"value":0,"status":0,"name":"","nameEn":""},"voltage":{"value":4,"status":0,"name":"","nameEn":""}},"timestamp":"2026-03-12 03:15:59"},"eventSender":"monitor","eventType":"cabinetRealTimeInfoChange"}
20:15:59.741310 IP 10.0.81.223.49765 > 10.0.81.207.vcom-tunnel: Flags [.], ack 9642, win 2048, options [nop,nop,TS val 538669955 ecr 977332225], length 0
E..4..@.@...
.Q.
.Q..e.A.22..5.h...........
 .s.:@..
20:15:59.741664 IP 10.0.81.207.vcom-tunnel > 10.0.81.223.49765: Flags [P.], seq 9642:10662, ack 91, win 508, options [nop,nop,TS val 977332225 ecr 538669955], length 1020
E..0e.@.@...
.Q.
.Q..A.e.5.h.22......(.....
:@.. .s..~..{"eventData":{"cabinetID":7540236130385923,"rvCardID":7540236130385923,"netPortIndex":2067,"cabinetIndex":3,"runtime":0,"totalRuntime":0,"temperature":{"value":45,"status":0,"name":"","nameEn":""},"voltage":{"value":4,"status":0,"name":"","nameEn":""},"humidity":{"value":0,"status":0,"name":"","nameEn":""},"errorBit":[{"value":0,"type":0,"status":0},{"value":0,"type":1,"status":0}],"signalInterruptCount":0,"backupStatus":{"mode":0,"status":0},"nextCabinetLinkStatus":{"linkStatus":true,"status":0},"phyTemperature":{"phy1":{"value":0,"status":0,"name":"","nameEn":""},"phy2":{"value":0,"status":0,"name":"","nameEn":""}},"moduleInfos":null,"cabinetMonitorInfo":{"cabinetID":0,"power":null,"temperature":{"value":0,"status":0,"name":"","nameEn":""},"humidity":{"value":0,"status":0,"name":"","nameEn":""},"smoke":{"value":0,"status":0,"name":"","nameEn":""},"voltage":{"value":4,"status":0,"name":"","nameEn":""}},"timestamp":"2026-03-12 03:15:59"},"eventSender":"monitor","eventType":"cabinetRealTimeInfoChange"}
20:15:59.741685 IP 10.0.81.223.49765 > 10.0.81.207.vcom-tunnel: Flags [.], ack 10662, win 2048, options [nop,nop,TS val 538669955 ecr 977332225], length 0
E..4..@.@...
.Q.
.Q..e.A.22..5.d...........
 .s.:@..
20:15:59.742175 IP 10.0.81.207.vcom-tunnel > 10.0.81.223.49765: Flags [P.], seq 10662:11682, ack 91, win 508, options [nop,nop,TS val 977332226 ecr 538669955], length 1020
E..0e.@.@...
.Q.
.Q..A.e.5.d.22......?.....
